business_id,categories,name,address,city,state,postal_code,stars,review_count,is_open,TypeCusine
xH4EuOcHpOJdbHUoJNfyGg,"Restaurants, Indian, Food Stands, Food",Sree's Indian Truck,Margaret Morrison St,Pittsburgh,PA,15213,3.0,4,0,American
L5OapgBUzqueHjuBhEQwsw,"Nightlife, Restaurants, American (Traditional), Food, Beer, Wine & Spirits, Bars, Burgers",Stack'd Burgers & Beer - Oakland,3716 Forbes Ave,Pittsburgh,PA,15213,3.5,107,1,American
ZYcBEhCSfbLOUM9JbHB9FA,"Breakfast & Brunch, Bakeries, Convenience Stores, Delis, Food, Desserts, Restaurants",Corner Mercantile,472 Wood St,Pittsburgh,PA,15222,4.5,30,1,American
xjViuMrrApPM6Rnz8ovOVw,"Restaurants, Pizza",Chuck E Cheese's,20 McIntyre Square Dr,Pittsburgh,PA,15237,3.0,10,1,American
Ch5uSE0lWuXlRGV9bDVyXg,"Italian, Restaurants",Costanzo's,"100 5th Ave, Ste 200",Pittsburgh,PA,15222,1.5,3,1,American
8edTRAKWTzd0B_sfb8ekeQ,"Vegetarian, Mediterranean, Restaurants, Vegan, Specialty Food, Middle Eastern, Food, Ethnic Food",Aladdin's Eatery,630 Washington Rd,Pittsburgh,PA,15228,4.0,118,1,American
7hDLmP8WRdIpb5Bqzv1nwQ,"American (Traditional), Bars, Restaurants, Nightlife, American (New), Food, Burgers",TGI Fridays,1027 Fifth Ave,Pittsburgh,PA,15219,2.5,42,1,American
jrlkSj1TR6HWBaOJ4AzwKw,"Sushi Bars, Dim Sum, Restaurants, Chinese",Pacific Ring,1900 Murray Ave,Pittsburgh,PA,15217,3.0,14,0,American
j6BfGByroCB585NPUnIHBg,"Restaurants, Pizza",Conca D'oro Pizzeria,916 Presque Isle Dr,Pittsburgh,PA,15239,4.0,7,1,American
#NAME?,"Restaurants, American (New), Bars, Sandwiches, Nightlife, Sports Bars",Primanti Bros,830 Clairton Blvd,Pittsburgh,PA,15236,3.5,74,1,American
8Jub_J2ILU0xYYnsgcd7UQ,"Mexican, American (New), Restaurants, Food",Silvi's Southside Kitchen,2212 E Carson St,Pittsburgh,PA,15203,4.0,4,0,American
lRfteK8D_8pfoFTk4ZuOqw,"Restaurants, Fast Food, Burgers",Wendy's,4524 Browns Hill Rd,Pittsburgh,PA,15217,1.5,18,1,American
zLzRiXSCYrUEpA2MuvZihw,"Breakfast & Brunch, American (New), Event Planning & Services, Venues & Event Spaces, Restaurants, Wine Bars, Nightlife, Bars",Roost,"242 Forbes Ave, Second Floor",Pittsburgh,PA,15222,3.0,13,1,American
F11rn41dsHTz4vmv-xyzAg,"Soul Food, Restaurants",Big Mama's House of Soul,1603 Penn Ave,Pittsburgh,PA,15289,4.0,4,0,American
BoTb3FqOsJaFe_koVfyGbw,"Restaurants, Mexican, Fast Food",Chipotle Mexican Grill,509 Clairton Blvd,Pittsburgh,PA,15236,2.5,41,1,American
IlkzevKMF1hGYEbrd04J5A,"Nightlife, American (Traditional), Pubs, Restaurants, Bars",Silky's Pub,5135 Liberty Ave,Pittsburgh,PA,15224,3.5,73,1,American
PuMpFTKS6gY_e31UP5YVnw,"American (New), Restaurants",Fifth Avenue Place Food Court,120 5th Ave,Pittsburgh,PA,15222,3.5,3,1,American
Bh6M_VzX9RH1BS8W-uoUwQ,"Beer Gardens, Nightlife, Bars, Restaurants, Wine Bars",Biergarten,620 William Penn Pl,Pittsburgh,PA,15219,3.5,56,1,American
ndT140pWrEvBnMDb5k4ljg,"Restaurants, Barbeque, Southern",Ribs N Bread,4707 Centre Ave,Pittsburgh,PA,15213,3.5,3,1,American
eRoOfy-lQso6N3GiUY_c3w,"Sports Bars, Restaurants, American (Traditional), Pubs, Bars, Nightlife",Redbeard's On Sixth,144 6th St,Pittsburgh,PA,15222,3.0,160,1,American
2dNjePYVp2AVei4ZoSDaaA,"Cocktail Bars, Car Dealers, Arts & Entertainment, Bars, Cuban, Real Estate Agents, Real Estate, Home Services, Music Venues, Automotive, Restaurants, Nightlife, American (Traditional)",The Goldmark,4517 Butler St,Pittsburgh,PA,15201,4.0,24,1,American
uxRBduJIbkY5FFfJCVVdVQ,"Vegetarian, Food Trucks, Mexican, Local Flavor, Sandwiches, Food, Vegan, Tacos, Restaurants",Cool Beans Taco Truck,500 E North Ave,Pittsburgh,PA,15212,3.5,11,1,American
4f1zK0LmCcpB-qad0KdlxQ,"Restaurants, Pizza, Beer, Wine & Spirits, Nightlife, Bars, Food",IVP Bar & Grill,2126 E Carson St,Pittsburgh,PA,15203,2.0,9,0,American
tmCLmE3yfILnCC1EwhJ8gA,"Soup, Food, Bagels, Restaurants, Breakfast & Brunch, Coffee & Tea, Salad, Sandwiches",Panera Bread,136 Bakery Square Boulevard,Pittsburgh,PA,15206,2.5,37,1,American
5miOOTlAtDJQtTwuQXgYxw,"Restaurants, Nightlife, Salad, Bars, American (New), Burgers, Cocktail Bars, American (Traditional), Sandwiches",Bar Louie,"330 N Shore Dr, Bldg 1B",Pittsburgh,PA,15212,3.0,144,1,American
oxZmj2rq9U9smW7a6S2nJA,"Barbeque, Restaurants, Southern",Walter's BBQ | Southern Kitchen,4501 Butler St,Pittsburgh,PA,15201,3.0,70,1,American
jCf84-Amxm91rbNAOJtAcg,"Restaurants, Pizza",Italian Village Pizza,5886 Forbes Ave,Pittsburgh,PA,15217,3.5,32,0,American
lo-GEcfXVGrDSDLtR5gI5w,"Sandwiches, Burgers, Restaurants, Pizza",Veltre's Pizza,1268 Brinton Rd,Pittsburgh,PA,15221,4.5,28,1,American
Z2NIEKTVVP2nEmOF4jNxqQ,"Restaurants, Sandwiches, Food, Ice Cream & Frozen Yogurt",Millie's Homemade Ice Cream,232 S Highland Ave,Pittsburgh,PA,15206,4.5,310,1,American
G0tUd_gFsRMGY3HXQQ3FJQ,"Sandwiches, Pizza, Italian, Restaurants",Fox's Pizza Den,902 Brookline Blvd,Pittsburgh,PA,15226,4.0,10,1,American
gXpGMGBAv1lfQEcPOzahag,"Restaurants, Mediterranean",Madonna's Mediterranean Cuisine,408 Smithfield St,Pittsburgh,PA,15219,4.5,96,1,American
vXhlnFw9k5ch1GVFOlddgQ,"Pizza, Asian Fusion, Sushi Bars, Japanese, Desserts, Thai, Food, Restaurants",Umai,297 Beverly Rd,Pittsburgh,PA,15216,3.5,70,0,American
pdn3iFRubS5SzkFL8J-32w,"Restaurants, Indian, Pakistani",Kabab N Curry,2890 Banksville Rd,Pittsburgh,PA,15216,4.0,8,1,American
SOxdLaL1Hni_lZ5Ph6Bdtg,"Restaurants, Italian",Linguini's Italian Grill,77 Clairton Blvd,Pittsburgh,PA,15236,3.5,3,0,American
ddgdt0ab4xY6iIqI5eX8Zw,"Burgers, Restaurants, Fast Food",Burger King,564 Forbes Ave,Pittsburgh,PA,15219,3.0,5,1,American
CVfiajCyFamUrvN0eKE_XA,"Restaurants, French",Bertrand,1910 Cochran Rd,Pittsburgh,PA,15220,4.5,18,1,American
#NAME?,"Mediterranean, Turkish, Restaurants, Modern European",Istanbul Grille,1103 S Braddock Ave,Pittsburgh,PA,15218,4.5,100,1,American
KlmsNi7qiQgC6yznyA0M0g,"Soup, Restaurants, Sandwiches, Cafes, Salad",Panera Bread,1000 Ross Park Mall Dr,Pittsburgh,PA,15237,4.0,6,1,American
rtj550X5w4tDWcTE8oAgew,"Restaurants, Ice Cream & Frozen Yogurt, Pizza, Food",Bishop's Pizza,2104 Brownsville Rd,Pittsburgh,PA,15210,3.0,6,0,American
i-2OzvZUDtvKCMq1vcRSZg,"Sandwiches, Bars, Nightlife, Restaurants",Triangle Bar & Grill,2122 Monongahela Ave,Pittsburgh,PA,15218,4.5,96,1,American
5kA4hmzNNWGGrwvoiGnIrg,"Restaurants, Food, Desserts, Latin American, Coffee & Tea, Sandwiches",Tango Cafe,5806 Forward Ave,Pittsburgh,PA,15217,4.5,9,0,American
LLGGe9k7NTVy1Z2wH1_Uew,"Chinese, Restaurants",Tong's Cuisine,228 Semple St,Pittsburgh,PA,15213,3.5,45,1,American
7LlND5b0bjWylNBNQ-oZMA,"Restaurants, Chinese",Green Garden,300 Beverly Rd,Pittsburgh,PA,15216,2.5,22,1,American
0tsl6aGhI-4nJgeVRfC3HQ,"Restaurants, Sandwiches, Hot Dogs, Fast Food",Mr. Beaners Drive-Thru Weiners,6520 Saltsburg Rd,Pittsburgh,PA,15235,4.0,6,0,American
93otbGHE0s0m-lU1osvg9w,"Bars, Restaurants, Pubs, Nightlife, American (New)",Rivertowne,337 N Shore Dr,Pittsburgh,PA,15212,3.0,132,1,American
LgvarcLVy6h7WiPKMRzz3Q,"Food, Restaurants, Gluten-Free, Pizza",Giovanni's Pizza & Pasta,3047 W Liberty Ave,Pittsburgh,PA,15216,3.0,77,1,American
Mh7C6p0KsuZLCB0vjrPgbQ,"Pubs, Beer Bar, Bars, Sports Bars, Restaurants, Sandwiches, Nightlife",The Modern Cafe,862 Western Ave,Pittsburgh,PA,15233,4.0,64,1,American
DkLkQTDISbGdEZXlVBdLmA,"Delis, Food Delivery Services, Food, Sandwiches, Fast Food, Restaurants, Salad",Jimmy John's,6425 Penn Ave,Pittsburgh,PA,15206,3.0,28,1,American
dUpQASSr7YfrfW1sB9Y-UA,"Nightlife, Karaoke, Bars, Gay Bars, Restaurants",There Ultra Lounge,931 Liberty Ave,Pittsburgh,PA,15222,3.0,11,1,American
ia2QAAxIyjpyr99926QrFQ,"Seafood, Restaurants, Soul Food",Soul & Sea,10718 Frankstown Rd,Pittsburgh,PA,15235,4.0,10,1,American
MiqI3DMf48AJQbfoG6fTRA,"Event Planning & Services, Mexican, Food, Fast Food, Restaurants, Caterers",QDOBA Mexican Eats,1740 Settlers Ridge Center Dr,Pittsburgh,PA,15205,3.0,17,0,American
J0UG_QARO4bwYlxfosP2aw,"Restaurants, Pizza",Papa John's,3336 Babcock Blvd,Pittsburgh,PA,15237,1.5,10,1,American
_AKdBFzkl7GY-daxUCCbVA,"Asian Fusion, Restaurants, Chinese, Gluten-Free",P.F. Chang's,1600 Settlers Ridge Center Dr,Pittsburgh,PA,15205,3.0,86,1,American
PqBZ88vOqctCc0fRm2sXQg,"American (Traditional), Italian, American (New), Restaurants",17th Street Cafe,75 S 17th St,Pittsburgh,PA,15203,3.5,34,0,American
kolFb44M7k9c0-tZL2D_Cg,"Pizza, Restaurants",Sunseri Pizza,2805 Custer Ave,Pittsburgh,PA,15227,4.0,20,1,American
_FH3osvpPRnMv-K2u6ZM3w,"Sandwiches, Restaurants, Burgers, American (Traditional)",Peppi's,927 Western Ave,Pittsburgh,PA,15233,4.5,109,1,American
QcxB4grIr-bLSqqydTV6Ag,"American (Traditional), Grocery, Restaurants, Diners, Breakfast & Brunch, Food",Millvale Diner,301 N Ave,Pittsburgh,PA,15209,3.5,50,1,American
b6WRBVDieqwei4wC1rOsnA,"Hot Dogs, Sandwiches, Restaurants",Wiener World,626 Smithfield St,Pittsburgh,PA,15222,3.5,38,1,American
EkrQy-HGatKn-2PTssaJ9g,"Diners, Food, Coffee & Tea, Restaurants",No Name Coffee Shop,536 Brookline Blvd,Pittsburgh,PA,15226,4.0,10,1,American
N9n4bj5nnuvVgt8iyT5YVg,"Sandwiches, Salad, Restaurants, Greek",Zorba's Gyros,400 Smithfield St,Pittsburgh,PA,15222,3.5,35,1,American
YLnrLMUGa6PJZFaOs8etEQ,"Italian, Restaurants",F. Tambellini Ristorante,139 7th St,Pittsburgh,PA,15222,2.0,19,0,American
6OLwyulRuqgghzYBa2TabQ,"Bars, Restaurants, American (New), Nightlife",Stone Pepper's Grill Bar,1614 Washington Rd,Pittsburgh,PA,15241,3.0,20,0,American
7bSE9GOvftLyvwvyz9XJoA,"Restaurants, American (Traditional), Steakhouses, Nightlife, Sports Bars, Burgers, Bars",Applebee's Grill + Bar,2045 Lebanon Church Rd,Pittsburgh,PA,15122,3.0,42,1,American
8nLxiZc7vr_GI6GcFhWc0g,"Sports Bars, Restaurants, Barbeque, Bars, Nightlife",Buffalo Blues,216 S Highland Ave,Pittsburgh,PA,15206,3.0,68,0,American
t7zt6AgybRzdPtj7fh_aJg,"Restaurants, Barbeque",Smoq Pitt,600 Brookline Blvd,Pittsburgh,PA,15226,3.5,86,0,American
oia3V-RDZepljWUGCRVdaw,"Fast Food, Burgers, Restaurants",Burger King,3220 Library Rd,Pittsburgh,PA,15234,3.5,3,1,American
F2Sz8PJ5j1JSwFNsB4bb3w,"Indian, Restaurants",Indian Spices,129 6th St,Pittsburgh,PA,15222,3.5,64,1,American
48nQpsNiVcnTR0nXxsg7yA,"Caterers, Restaurants, Diners, Breakfast & Brunch, Food, Coffee & Tea, Event Planning & Services",Trolley Barn Eatery,"3360 Library Rd, Ste 4",Pittsburgh,PA,15234,4.0,24,1,American
HzOYnyPrh24YONMUecuzlg,"Restaurants, Fast Food, Delis, Specialty Food, Sandwiches, Food Delivery Services, Food",Jimmy John's,506 Liberty Ave,Pittsburgh,PA,15222,3.5,15,1,American
dAcaMSkrpYUZocqrLvOzRQ,"Mexican, Restaurants",Los Cabos Mexican Restaurant,4108-10 Penn Ave,Pittsburgh,PA,15224,3.5,126,1,American
NSBiCz9CRowb6uwpC3vZrQ,"American (Traditional), Hotels & Travel, Hotels, Event Planning & Services, Wedding Planning, Restaurants",Hyatt Regency Pittsburgh International Airport,1111 Airport Blvd,Pittsburgh,PA,15231,3.0,98,1,American
U-2-_MrmHPawNcGRYRoDqw,"Nightlife, Restaurants, Bars, Italian, Sports Bars",Champ's Sports Grill & Lounge,540 Rodi Rd,Pittsburgh,PA,15235,5.0,7,1,American
tFlQiwIH0MyYeajld8BheQ,"Mexican, Restaurants",Steel Cactus Bethel Park,1000 Cool Springs Dr,Pittsburgh,PA,15234,2.5,20,1,American
Rwahe1zbFpw6VIjb5ngZeg,"American (New), Desserts, Restaurants, Modern European, Caterers, Event Planning & Services, Food",Sausalido,4621 Liberty Ave,Pittsburgh,PA,15224,4.0,159,1,American
TY_kMmCM_3JSs14NFUvO_g,"Korean, Barbeque, Restaurants, American (New)",Nak Won Garden,5504 Centre Ave,Pittsburgh,PA,15232,3.5,111,1,American
ZHYSz-c2GEbCfQmxTIZ7gg,"Gastropubs, Restaurants",Stout Pub & Kitchen,690 Chauvet Dr,Pittsburgh,PA,15275,3.5,77,1,American
CFBDAdWVxOhFFRTa5Fp30Q,"Restaurants, Pizza, Food, Italian",The Diamond Pizza,101 Federal St,Pittsburgh,PA,15212,3.5,5,0,American
BtcxknU-6axQwOhXvv9xkQ,"Nightlife, Bars, Pubs, Restaurants",The Park House,403 E Ohio St,Pittsburgh,PA,15212,4.0,72,1,American
7ndalFukYiEalNeN4eL9vQ,"Barbeque, Restaurants, Steakhouses",Texas Roadhouse,3466 William Penn Hwy,Pittsburgh,PA,15235,3.5,28,1,American
q1XzmZ2afZQ8S7Ka34-xyQ,"Bars, Nightlife, Pubs, Restaurants, American (Traditional), Food",The Warehouse Pub & Grub,1731 Murray Ave,Pittsburgh,PA,15217,3.0,3,1,American
qNRyP8ItRICZOnKS4jf5ig,"Restaurants, Coffee & Tea, Food, Bagels",The Bagel Factory,420 S Craig St,Pittsburgh,PA,15213,2.0,204,1,American
uBroDHaLcXSE24c8EhPvmw,"American (New), Restaurants, Bars, Diners, Nightlife",Eighty Acres Kitchen & Bar,1910 New Texas Rd,Pittsburgh,PA,15239,4.0,96,1,American
esF6vzW_Owwxj3s5I6nlvg,"Restaurants, Pizza",Di Salla's Pizza Parlor,948 E 8th Ave,Pittsburgh,PA,15120,4.0,5,1,American
u0F9WJbECpg5fEesAx94xA,"Food, Juice Bars & Smoothies, Restaurants, Latin American, Empanadas, Colombian",The Colombian Spot,2019 E Carson St,Pittsburgh,PA,15203,4.5,92,1,American
XMJpOti7qAamQFfHJwFBSQ,"Bars, American (New), Dive Bars, Nightlife, Restaurants",Remedy Restaurant and Lounge,5121 Butler St,Pittsburgh,PA,15201,3.5,55,1,American
rXULENMtBohv3485zqG0XA,"Pizza, Salad, Restaurants, Sandwiches",Crust! Cafe and Pizzeria,509 Painters Run Rd,Pittsburgh,PA,15228,4.0,54,1,American
FcXGZFrVPaKfe3wJZibfCw,"Restaurants, Italian",Caffe Davio,2516 E Carson St,Pittsburgh,PA,15203,4.0,39,0,American
uUAWbVSARYcuS34rOT-X7A,"Diners, Restaurants, Middle Eastern",Naya Cuisine,2018 Murray Ave,Pittsburgh,PA,15217,4.0,102,1,American
rLNIlmJ71srkLoMFfGMvyQ,"Wedding Planning, Cafes, Specialty Food, Bakeries, Chocolatiers & Shops, Food, Restaurants, Local Flavor, Event Planning & Services, Cupcakes",Le Petit Chocolat & Cafe,2004 E Carson St,Pittsburgh,PA,15203,4.5,47,1,American
yIMZ8XeGJePfYWr7BBNzww,"Italian, Pizza, Restaurants",Maldini's Taste of Italy,1900 Monongahela Ave,Pittsburgh,PA,15218,3.0,14,1,American
815I4_qtNd9Whd5joLZhAQ,"Salad, Restaurants, Burgers, Pizza",Gino's Pizza,1610 E Carson St,Pittsburgh,PA,15203,2.0,27,1,American
gndb2XMDHYI5OEDvwEKwaQ,"Pizza, Restaurants, Chicken Wings, Sandwiches",Domino's Pizza,11822 Frankstown Rd,Pittsburgh,PA,15235,2.5,12,1,American
Uh6EhbFKgQlhVpfvnqsfHA,"Caterers, Restaurants, Event Planning & Services, Food, Bakeries",BreadWorks,2110 Brighton Rd,Pittsburgh,PA,15212,4.5,30,1,American
MEyguHG-U-Fy1qkK_Yf_FQ,"Polish, Salad, Restaurants",Stuff'd Pierogi Bar,130 7th St,Pittsburgh,PA,15222,3.0,152,1,American
_Oe8NDjmeYkkHFs7f8CekA,"Indian, Restaurants, Food, Food Trucks",Chakh Le India,4341-4379 Bigelow Blvd,Pittsburgh,PA,15213,4.0,20,1,American
SLlQSsSHukMz4-3-eaOgUA,"Event Planning & Services, Fast Food, Caterers, Restaurants",Chick-fil-A,"3990 5th Ave, University of Pittsburgh Tower, University Of Pittsburgh Tower",Pittsburgh,PA,15213,2.5,3,1,American
MqBn0tb5rELHo6d9-8l-eA,"Soul Food, Restaurants",Frederick's Soul Food,633 Smithfield St,Pittsburgh,PA,15222,2.5,4,0,American
mc5Ha4QyQZvU7fzr-ubhhw,"Restaurants, Bars, Nightlife, American (New), Cocktail Bars, Gastropubs",Station,4744 Liberty Ave,Pittsburgh,PA,15224,4.0,187,1,American
bZpVmhdKkNCDpdRO-bFMfw,"Coffee & Tea, Bagels, Sandwiches, Food, Restaurants",Einstein Bros Bagels,4910 Baum Blvd,Pittsburgh,PA,15213,4.0,30,1,American
AspFf1d9sRaUloPJAHMqAg,"Sushi Bars, Korean, Restaurants",Sushi Kim Restaurant,1241 Penn Ave,Pittsburgh,PA,15222,3.5,138,1,American
evakMk_jHxl2vQ5gvI43aA,"Pizza, Sandwiches, Cafes, Restaurants, American (Traditional)",Skibo Cafe,"5000 Forbes Ave, 2nd Fl",Pittsburgh,PA,15213,2.5,11,0,American
2p_xWNAGm_5sVvr_Vs6mlw,"Italian, Restaurants",Trapuzzano Italian Chophouse,5533 Walnut St,Pittsburgh,PA,15232,3.5,45,0,American
v2LLg08clPWKyNQFBVlZXg,"American (New), Salad, Restaurants",Toss't,218 5th Ave,Pittsburgh,PA,15222,3.5,44,0,American
MdR6htOIm-LF051qUCKmGg,"Restaurants, Steakhouses",Pittsburgh Chop House,5305 Campbells Run Rd,Pittsburgh,PA,15205,3.0,4,0,American
Es0JayHVN_XPn1q5yFtn6g,"Steakhouses, Restaurants",Pittsburgh Rare,300 W Station Sq Dr,Pittsburgh,PA,15219,2.5,9,0,American
b8ublvizuqIw3Ib8pK4fDw,"Mexican, Restaurants",Verde Mexican Kitchen & Cantina,5491 Penn Ave,Pittsburgh,PA,15206,3.5,271,0,American
7l-CCyNnvT86GMR5EtYjog,"Bars, American (Traditional), Nightlife, Restaurants, Gastropubs, Pubs",Shiloh Grill,123 Shiloh St,Pittsburgh,PA,15211,4.0,334,1,American
LRHlcXcNERVsekrngMLphA,"Restaurants, Pizza",Pittzarella,1302 E Carson St,Pittsburgh,PA,15203,3.0,11,1,American
Ac-DbrST8bF9Cpge5D9_Cg,"Restaurants, Vietnamese",Pho Kim 88,4100 Library Rd,Pittsburgh,PA,15234,4.0,146,1,American
YuEkAjS57Jv8C_NCMCLDUw,"Peruvian, Restaurants",Ajs burger Peruvian restaurant,110 Smithfield St 2nd,Pittsburgh,PA,15222,3.5,24,1,American
1ofeAP5vdjnOSeO5S2pzSg,"Chinese, Restaurants, Fast Food",Panda Express,202 Robinson Center Dr,Pittsburgh,PA,15205,3.0,18,1,American
cdwJYqlp_NjS1w5Tz4J5dw,"Cafes, Shopping, Fashion, Restaurants, Tattoo, Food, Beauty & Spas, Coffee & Tea, Arts & Entertainment, Art Galleries, Piercing",Artisan,5001 Penn Ave,Pittsburgh,PA,15224,4.5,30,1,American
8mx_TpMhpFLdQi_K5aPdOg,"Bagels, Sandwiches, Restaurants, Breakfast & Brunch, Food",Bruegger's Bagels,26 Market St,Pittsburgh,PA,15222,2.0,33,1,American
blq-6xx8vKcm1Va4LFSORg,"Mediterranean, American (New), Desserts, Food, Restaurants",Wild Rosemary,1469 Bower Hill Rd,Pittsburgh,PA,15241,4.0,63,1,American
o5rtJcyJ6xje1PFj_rhRTA,"Restaurants, Chinese",Golden Palace Chinese Restaurant,206 Shiloh St,Pittsburgh,PA,15211,2.0,9,0,American
8L8QlR4XJeAblTKCqoDP0A,"Food Trucks, Tacos, Mexican, Restaurants, Food",Bull River Taco,4849 Clairton Blvd,Pittsburgh,PA,15236,4.0,81,1,American
8DFecBZD_b4CAVhFLBp9hw,"Restaurants, Food Trucks, Sandwiches, Food",The Rolling Kitchen,,Pittsburgh,PA,15233,4.5,3,1,American
QcFZRiYVLFGTJhjJzPIJGA,"Pizza, Restaurants",Little Caesars Pizza,"5301 Grove Rd, Ste 619",Pittsburgh,PA,15236,2.5,3,1,American
7svK0DI4BOP0cqjSww7cZQ,"Burgers, Fast Food, Food, Coffee & Tea, Restaurants",McDonald's,7702 Mc Knight Rd,Pittsburgh,PA,15237,1.5,5,1,American
T0dN9-NfwF_YD2fSQRu9AQ,"Mexican, American (Traditional), Dive Bars, Bars, Nightlife, Cafes, Restaurants",Gus' Cafe,4717 Butler St,Pittsburgh,PA,15201,3.0,77,0,American
cvELVLQ4jbS5Qqbm79IxVA,"Restaurants, Indian",Taal Indian Cuisine,2100 Broadway Ave,Pittsburgh,PA,15216,3.5,16,0,American
_9DqfW3Nv8Brb-1fz5XyOQ,"Mediterranean, Restaurants, Greek",Kebab Factory,121 Oakland Ave,Pittsburgh,PA,15213,3.5,34,0,American
wmCBxE0PfLZD8sxIwAY59Q,"Food, Bars, Pubs, German, Restaurants, Breweries, French, Nightlife",Hofbrauhaus Pittsburgh,2705 S Water St,Pittsburgh,PA,15203,4.0,683,1,American
VBhPgceaKWOXT71d3Jp38w,"Chinese, Korean, Japanese, Restaurants, Asian Fusion",Soba,5847 Ellsworth Ave,Pittsburgh,PA,15232,4.0,310,1,American
T4648Rp4gRKqKHVzQgQ3fA,"Japanese, Restaurants, Korean",Ginza Korean & Japanese Restaurant,239 Atwood St,Pittsburgh,PA,15213,3.0,13,0,American
04kZ5CSh6oKhI5huU5bLdg,"Belgian, Nightlife, Desserts, American (New), Pubs, Bars, Food, Beer Bar, Restaurants",Bistro Penn,922 Penn Ave,Pittsburgh,PA,15222,3.0,254,1,American
74O-ZufCco3hBcMQc3Vf8Q,"Noodles, Restaurants, Chinese",iNoodle,1060 Morewood Ave,Pittsburgh,PA,15213,2.0,4,1,American
g4MOiCPPNBSuTm3BrYRtbg,"Hot Dogs, Restaurants, Street Vendors, Food",The Shady Dog,Corner Of Baum And Libert,Pittsburgh,PA,15232,4.5,10,1,American
uXjc2pnnhHXL-gXYYP0nWg,"Mexican, Restaurants",Jose' Ole' Mexican Grill,6535 Robinson Ctr Dr,Pittsburgh,PA,15205,4.5,13,0,American
sReFrTIJ92iDprWD8dKAuw,"Restaurants, Szechuan, Chinese",Phong May House,2351 Noblestown Rd,Pittsburgh,PA,15205,3.0,23,1,American
hUHIahAcew5i39D_6ZqEmQ,"Steakhouses, Italian, Seafood, Restaurants",Donatos Fox Chapel,46 Fox Chapel Rd,Pittsburgh,PA,15238,3.0,47,0,American
8B7A5KqrrbxOlCX66hqfOg,"Restaurants, Steakhouses, American (Traditional), Seafood",McCormick & Schmick's Seafood & Steaks,301 5th Ave,Pittsburgh,PA,15222,3.0,131,1,American
plHKBwA18aWeP-TG8DC96Q,"Restaurants, Barbeque, Burgers, Mexican, Tacos",Smoke BBQ Taqueria,4115 Butler St,Pittsburgh,PA,15201,3.5,405,1,American
tpJrlhn5QPI0ehDyYjN7qg,"Food, Caterers, Delis, Event Planning & Services, Restaurants, Specialty Food",Szmidt's Old World Deli,509 Greenfield Ave,Pittsburgh,PA,15207,4.5,87,0,American
vWYK4XApgyT7mbtmNqIxxg,"Restaurants, Caribbean, Mexican",Casa Rasta,130 S Highland Ave,Pittsburgh,PA,15206,2.5,21,0,American
cWsgD-u_TvTohsx6LSi9aQ,"Pizza, Restaurants",Villa Reale Pizzeria & Restaurant,628 Smithfield St,Pittsburgh,PA,15222,3.0,40,1,American
aTysOdHgV9ghIR48l0nyOA,"Restaurants, American (Traditional)",Andora,1928 Cochran Rd,Pittsburgh,PA,15220,4.0,8,0,American
Wj-73Uu3U79CGK_H_kyAsg,"Restaurants, Burgers, American (Traditional), Breakfast & Brunch, Steakhouses, Chicken Wings",Quaker Steak & Lube,"1000 Airport Blvd, concourse A",Pittsburgh,PA,15231,3.0,36,0,American
Iko1Ic3XzHJb8UoZmpfmOw,"Restaurants, Coffee & Tea, Sandwiches, Food",Cannon Coffee,802 Brookline Blvd,Pittsburgh,PA,15226,4.5,39,0,American
VaQhUU3P4Z5A3oYPsEMbkw,"Coffee & Tea, Cafes, Restaurants, Food, Delis",Tazza D'oro,1125 N Highland Ave,Pittsburgh,PA,15206,4.5,153,1,American
kxAQGy2ZpguB7zn8Nqgb_g,"Chinese, Food Trucks, Food, Food Stands, Restaurants",Moonlight Truck Food,Margaret Morrison St,Pittsburgh,PA,15213,3.0,6,1,American
_d69ooWJ_7AXYQRvVNSjmQ,"Restaurants, Chicken Wings, Italian, Pizza",Pizza Hut,7520 McKnight Rd,Pittsburgh,PA,15237,2.0,11,0,American
BFYVjjBOWkIttKdSk6P6pg,Restaurants,Mozart Room,600 Penn Ave,Pittsburgh,PA,15222,3.0,3,1,American
nAS-0Tdn_TFdlMfNQfldYA,"Food, Restaurants, Sandwiches, Beer, Wine & Spirits, Nightlife, Delis, Bars",Burg's in the Burgh,564 Forbes Ave,Pittsburgh,PA,15219,4.0,8,0,American
dLc1d1zwd1Teu2QED5TmlA,"Thai, Restaurants, Noodles, Food",Noodlehead,242 S Highland Ave,Pittsburgh,PA,15206,4.5,1096,1,American
jUxLgiiYKnsM238eUZUqlA,"Restaurants, Pizza",Sir Pizza,320 Sewickley Oakmont Rd,Pittsburgh,PA,15237,3.0,55,1,American
EwraUz9DLJcMVnBVMGkBpA,"Chicken Wings, Sandwiches, Restaurants, Salad",Wiggy's,2350 Noblestown Rd,Pittsburgh,PA,15205,4.0,55,1,American
xJTu-eNbVET4evm-eBVDzA,"Ramen, Japanese, Restaurants, Sushi Bars",Tan Izakaya,815 S Aiken Ave,Pittsburgh,PA,15232,3.5,89,0,American
5kUA_k-ua1wO68jZ1Yo74Q,"Tapas Bars, Restaurants, Sushi Bars, Latin American",Tamari,3519 Butler St,Pittsburgh,PA,15201,4.0,276,0,American
QQSlx-l_cfwkVrNwjV_HgQ,"Restaurants, Chinese",House of Lee Restaurant,8145 Ohio River Blvd,Pittsburgh,PA,15202,3.0,34,1,American
l1hqzJAIYEs3NQYqjH_kxA,"Pizza, Italian, Restaurants, Salad",Vespucci Pizza,1710 Forbes Ave,Pittsburgh,PA,15219,2.5,19,0,American
IrkBeajv3BQFYwJC9i0e1g,"American (New), Seafood, Restaurants, Bars, Whiskey Bars, Nightlife",Wallace's Whiskey Room + Kitchen,123 N Highland Ave,Pittsburgh,PA,15206,3.5,7,1,American
QCZwZLYHkTyYQDr6jdjKjA,"Restaurants, Pizza",Graziano's Pizzeria,4109 Penn Ave,Pittsburgh,PA,15224,3.5,35,1,American
I4q_mNQTKVX_EKbVAh8pdQ,"American (New), Nightlife, Bars, Restaurants",Houlihan's,100 Robinson Center Dr,Pittsburgh,PA,15205,3.0,28,0,American
ZYof0WYlilJ3pgWNSgmYKQ,"Restaurants, Pizza",Pizza Milano,1304 5th Ave,Pittsburgh,PA,15219,3.0,92,1,American
5E37qENVklkwAMHmIwc_IA,"Restaurants, Chinese",China Village,3360 Library Rd,Pittsburgh,PA,15234,4.5,5,0,American
0YA3RpY5KXcezPXcjdfOGQ,"Restaurants, Steakhouses, Sushi Bars, Seafood",Pittsburgh Steak Company,1924 E Carson St,Pittsburgh,PA,15203,2.5,10,0,American
dWB0HT1nXQ2N8n3bvPKJuQ,"Chinese, Restaurants, Sushi Bars",John's Chinese & Sushi Restaurant,1778 N Highland Rd,Pittsburgh,PA,15241,4.0,28,0,American
lPcKVCwnnx54lJR5BXFbKQ,"Restaurants, Cocktail Bars, Nightlife, Bars, Hawaiian",Hidden Harbor,1708 Shady Ave,Pittsburgh,PA,15217,4.5,145,1,American
0aT7sqTIIv5zMApt4p4VWQ,"Pizza, Restaurants",Pizza Roma,461 Perry Hwy,Pittsburgh,PA,15229,3.5,3,0,American
BrORoLCE5zVY6ekUb6omNA,"Noodles, Bubble Tea, Asian Fusion, Chinese, Restaurants, Food, Ramen, Japanese",Mad Noodles,2017 E Carson St,Pittsburgh,PA,15203,3.5,78,1,American
#NAME?,"Vegan, Restaurants, Southern, Barbeque",YinzBurgh BBQ,4903 Baum Blvd,Pittsburgh,PA,15213,4.0,170,1,American
ldGnkfXjRNAxRP9cizgr0Q,"Cafes, Sandwiches, Restaurants, Italian",Gio's Cafe,625 Stanwix St,Pittsburgh,PA,15222,4.0,19,0,American
_xynpPYhVYDQRtt69sw3sQ,"Pizza, Restaurants",Pizza Care,1525 5th Ave,Pittsburgh,PA,15219,2.0,4,0,American
EWpRPVSiPxWbdJBgNDNvGw,"Restaurants, Wraps, Italian, Salad",Piada Italian Street Food,"6296 Northway Mall Dr, Ste 102-B",Pittsburgh,PA,15237,4.5,56,1,American
_Ahg3MfDXfKrh36NUadNbA,"American (Traditional), Restaurants",Grille on Seventh,130 7th St,Pittsburgh,PA,15222,2.0,75,0,American
1n8bvxpBoUOAJsC5csuV3Q,"Restaurants, Pizza, Italian",DiCarlo's Original Pizza,2080 Saw Mill Run Blvd,Pittsburgh,PA,15210,4.5,11,0,American
85nvKTJSN8byoeGRxzGkug,"American (Traditional), Restaurants, Cafes, Breakfast & Brunch",First Watch,9176 Covenant Ave,Pittsburgh,PA,15237,4.0,112,1,American
sgmzN_YnOPtHAAfGlhc9yA,"Diners, Buffets, Bars, Restaurants, Nightlife, Italian, Lounges",John Anthony's Restaurant Lounge & Banquets,115 Center New Texas Rd,Pittsburgh,PA,15239,3.5,12,1,American
zR8n9zX3AMcksUI641DjfQ,"Food, Delis, Restaurants",Deli On North Avenue,4 E North Ave,Pittsburgh,PA,15212,4.5,28,1,American
aY8xiGLpTjIkz6FAJbCy7A,"Bars, Barbeque, Restaurants, Nightlife, American (Traditional), Vegetarian",Double Wide Grill,2339 E Carson St,Pittsburgh,PA,15203,3.5,438,1,American
QlSpPzc4Oy05ic-PsoYH4g,"Cocktail Bars, Sandwiches, Food, Nightlife, Bars, French, Restaurants, Tapas/Small Plates, Desserts",Streets On Carson,1120 E Carson St,Pittsburgh,PA,15203,4.5,113,1,American
Apn6Qly16cIUxgB1dYUvjg,"Diners, Restaurants",Don's Diner,1729 Eckert St,Pittsburgh,PA,15212,5.0,25,1,American
jDehhKtVZa62k32WHbnc2A,"Szechuan, Restaurants, Food, Food Delivery Services, Chinese",China Star,"Mcintyre Square Shopping Ctr, 3200 McIntyre Square Dr",Pittsburgh,PA,15237,3.5,43,0,American
OXrFWgoz533T8tMRemkiww,"Restaurants, Italian, Pizza",Il Pizzaiolo,703 Washington Rd,Pittsburgh,PA,15228,4.0,277,1,American
