business_id,categories,name,address,city,state,postal_code,stars,review_count,is_open,TypeCusine
1RHY4K3BD22FK7Cfftn8Mg,"Sandwiches, Salad, Restaurants, Burgers, Comfort Food",Marathon Diner,"Center Core - Food Court, Fl 3, Pittsburgh International Airport",Pittsburgh,PA,15231,4.0,35,1,American
dQj5DLZjeDK3KFysh1SYOQ,"Nightlife, Bars, Polish, Modern European, Restaurants, Vegan",Apteka,4606 Penn Ave,Pittsburgh,PA,15224,4.5,242,1,European
v-scZMU6jhnmV955RSzGJw,"Japanese, Sushi Bars, Restaurants",No. 1 Sushi Sushi,436 Market St,Pittsburgh,PA,15222,4.5,106,1,Japanese
t-6tdxRaz7s9a0sf94Tguw,"Restaurants, Caribbean",Impressionz,6008 Broad St,Pittsburgh,PA,15206,4.5,29,0,Caribbean
5WMIvoMx3l1vn1uJ3HZB6Q,"Fast Food, Sandwiches, Restaurants",Subway,411 7th Ave,Pittsburgh,PA,15219,3.0,3,1,American
q4P3WHwC0lFafwvTlkKMIw,"Restaurants, Pizza",Ron's Pizza Palace,1535 Lowrie St,Pittsburgh,PA,15212,3.0,6,1,American
hZj2HCiLae5-AxIp0im6lQ,"Bars, Nightlife, Restaurants, American (Traditional)",Route 28 Bar & Grille,180 Gamma Dr,Pittsburgh,PA,15238,2.5,7,1,American
F6c3D1o9Z4Tl6cDorb3WgA,"Burgers, Restaurants, Cafes, Salad, Sandwiches",Hello Bistro,701 Providence Blvd,Pittsburgh,PA,15237,3.5,75,1,American
nm5yx8yvJNJYVjaRPwjnsw,"Buffets, Restaurants",Misaki,860 Saw Mill Run Blvd,Pittsburgh,PA,15226,3.0,44,0,American
hZzwkAJG92KkszWO8PoOQA,"Fast Food, Sandwiches, Restaurants",Fernando's,2 Ppg Pl Food Ct,Pittsburgh,PA,15222,4.0,7,0,American
hOv0yRX4Km89-7vJuzPteg,"Cafes, Nightlife, Restaurants, Bars, Pubs",Spice Cafe,328 Atwood St,Pittsburgh,PA,15213,4.5,7,0,American
i68lkBrGgUVwOk-LSvMj_A,"Pakistani, Indian, Restaurants, Food",Sree's Foods,116 Meyran Ave,Pittsburgh,PA,15213,3.0,8,1,Indian
UmFty_GxdqVe35apYnmGbw,"Pizza, Restaurants",Showcase Pizza,109 Curry Hollow Rd,Pittsburgh,PA,15236,3.0,8,1,American
JrrY4v21k7_qYxIidhi-aw,"Lounges, Nightlife, American (Traditional), Bars, Restaurants",Kelly's Bar & Lounge,6012 Penn Cir S,Pittsburgh,PA,15206,3.5,166,1,American
BpJDI4Fj92lLNALQQeLvLg,"Pizza, Sandwiches, Salad, Restaurants",Slice On Broadway,115 Federal St,Pittsburgh,PA,15212,4.0,43,1,American
_WsGlZnbXBdPcs0qM2Qm7w,"Restaurants, Barbeque, Bars, Pubs, Burgers, Nightlife",Ryan's Pub,607 S Braddock Ave,Pittsburgh,PA,15221,3.0,18,0,American
IcHVYlgNGR-Zz8fnceiJ6g,"Restaurants, American (Traditional), Bars, Nightlife",The Monkey Bar,703 Clairton Blvd,Pittsburgh,PA,15236,4.0,26,1,American
sMzNLdhJZGzYirIWt-fMAg,"Cocktail Bars, Italian, American (New), Nightlife, Bars, Pizza, Restaurants",Sienna Mercato,942 Penn Ave,Pittsburgh,PA,15222,4.0,752,1,Italian
rGdaD3j8leOCI0zz3g5Beg,"Hot Dogs, Restaurants",Steves New York Hotdog Shop,1110 Federal St,Pittsburgh,PA,15212,5.0,5,0,American
FKQUxOfW_W5R4OTut4G1Vw,"Restaurants, Sandwiches",Peppi's,12 Smithfield St,Pittsburgh,PA,15222,4.0,37,1,American
Gp8_vPUZBncqy4Fwc8ga7A,"Restaurants, Fast Food",Go Pretzel,807 Liberty Ave,Pittsburgh,PA,15222,3.5,13,0,American
nxeeZnumQkrEFORtFpwSvA,"Nightlife, Restaurants, Bars, Burgers, Delis",Tavern In The Wall,211 Commercial Ave,Pittsburgh,PA,15215,3.5,28,1,American
K0dp91jd_vqW4uNgvW6oag,"Restaurants, Breakfast & Brunch",Valliant's Diner,3418 Babcock Blvd,Pittsburgh,PA,15237,3.0,32,1,American
JGXkldESnG69YXlSNVAgJQ,"Restaurants, American (Traditional), Nightlife, Bars",Eggheads,1162 Brookline Blvd,Pittsburgh,PA,15226,2.0,3,1,American
eU_713ec6fTGNO4BegRaww,"Restaurants, Italian, Pizza",La Tavola Italiana,1 Boggs Ave,Pittsburgh,PA,15211,3.5,132,1,Italian
zzwhN7x37nyjP0ZM8oiHmw,"Restaurants, American (New)",Carmody's Grille,4905 Grand Ave,Pittsburgh,PA,15225,4.0,54,1,American
jAQwIRxZNj2zndM5V9UOpw,"Restaurants, Country Clubs, Arts & Entertainment, Active Life, Golf",Pittsburgh Field Club,121 Field Club Rd,Pittsburgh,PA,15238,3.5,5,1,American
R19oiRejCcgRzbeYz2UQig,"Pizza, Food Stands, Sandwiches, Restaurants, Breakfast & Brunch",City Oven,3025 Banksville Rd,Pittsburgh,PA,15216,4.0,10,0,American
GD0XvS6HlCuDjtCDWiLkVQ,"Vegetarian, Restaurants, Food, Coffee & Tea",Kiva Han,420 S Craig St,Pittsburgh,PA,15289,3.0,35,0,American
c9UmJiX2G7hKMpivZ3h1oQ,"Gluten-Free, Italian, Chicken Wings, Restaurants, Vegan, Pizza, Vegetarian","Pastoli's Pizza, Pasta & Paisans",1900 Murray Ave,Pittsburgh,PA,15217,4.5,96,1,Italian
0VDcJitRHh5uJnkjymu_6A,"American (Traditional), Nightlife, Pubs, Bars, Restaurants",Fox & Hound English Pub & Grille,"8000 McKnight Rd, Ste 2002",Pittsburgh,PA,15237,2.0,26,0,American
jd1rD7jr-_zI46Oxh5lDLA,"Restaurants, Italian, Pizza",Antoon's Pizza,247 Atwood St,Pittsburgh,PA,15213,3.5,24,1,Italian
09pf_DnQV5Y5y2reoIPXlw,"Restaurants, American (New), Bars, Sports Bars, Sandwiches, Nightlife",Primanti Bros,5491 Penn Ave,Pittsburgh,PA,15206,3.5,36,1,American
B1dCyA21u1mG1bcrq9TTYg,"Restaurants, Chicken Wings, Seafood, Fish & Chips",Hook Fish & Chicken,11644 Frankstown Rd,Pittsburgh,PA,15235,3.0,11,1,American
V2TaLceKiGwy-y7bAGzPuQ,"Restaurants, Italian, Pizza, Chicken Wings",Pizza Hut,4048 Beechwood Blvd,Pittsburgh,PA,15217,1.5,3,0,Italian
#NAME?,"Restaurants, American (Traditional), Bars, Nightlife, Seafood, Wine Bars, American (New)",Savoy,2623 Penn Ave,Pittsburgh,PA,15222,3.5,138,1,American
R-GbmmHHfAyPo1qs4jo0TA,"Italian, Restaurants, Bars, Nightlife, Beer Gardens",Il Tetto:  A Rooftop Beer Garden,"942 Penn Ave, Fl 3",Pittsburgh,PA,15222,3.0,77,1,Italian
FE135tFrIhxrtAkf6-A1Rw,"Restaurants, American (Traditional), Fast Food, Burgers",Hardee's,1201 N Ave,Pittsburgh,PA,15209,4.0,22,1,American
z4CYPDxL_L74GnaD35a9Yw,"Noodles, Restaurants, Japanese, Ramen",Zen's Noodle House,3531 Forbes Ave,Pittsburgh,PA,15213,3.5,77,1,Japanese
TYZIMuHwhZo_Hizenmf8Pg,"Restaurants, Nightlife, Bars, American (New)",BZ's Bar and Grill,140 Federal St,Pittsburgh,PA,15212,3.0,79,0,American
by7BOr074_BKz7hkRIi9WQ,"Pizza, Restaurants",Sammy's Place,2350 Noblestown Rd,Pittsburgh,PA,15205,3.5,14,1,American
lK_iVjCur58if_XcbENGqg,"Pizza, Restaurants",Don Campiti's Pizzeria,1509 Potomac Ave,Pittsburgh,PA,15216,4.0,54,1,American
hNmSL-HfN_IdPlWXP1ILEw,"Mediterranean, Sandwiches, Delis, Restaurants, Pizza",New Way Gourmet,3832 Penn Ave,Pittsburgh,PA,15201,4.5,9,0,Mediterranean
b6vi3Ub0tbGzGtG-pVgJfQ,"Bakeries, Restaurants, Food",Dana's Bakery,720 N Homewood Ave,Pittsburgh,PA,15208,4.5,9,1,American
Xdoqt46KMRBiaWWMa41m1A,"Pubs, Pizza, Chicken Wings, American (Traditional), Beer, Wine & Spirits, Restaurants, Bars, Food, Nightlife",The Coal Mine,3160 Library Rd,Pittsburgh,PA,15234,4.0,4,1,American
5crOt_2vpHfFeGOrEeROQA,"Pizza, Restaurants, American (Traditional), Food, Coffee & Tea, Desserts, American (New), Breakfast & Brunch",Brunoise Restaurant,54 21st St,Pittsburgh,PA,15222,4.5,18,0,American
L0DJ7-GUDMLIlIR-7vykvQ,"Flowers & Gifts, Gift Shops, Shopping, Italian, Cooking Classes, Restaurants, Arts & Crafts",Merante's Gifts,4723 Liberty Ave,Pittsburgh,PA,15224,4.5,15,1,Italian
0IfrcGbFzQvn9w8bl9GKDg,"Restaurants, Food, Sandwiches, Juice Bars & Smoothies, Salad, Burgers",North Hills Grill,"96 Rochester Rd, 1st floor",Pittsburgh,PA,15229,4.5,39,0,American
PbOQlLSloU5Zkpth5I3cjA,"Restaurants, Pizza",Vocelli Pizza,617 Brownsville Rd,Pittsburgh,PA,15210,4.5,7,1,American
Qs5fQqmc_yWmgZjHcadU7g,"Sandwiches, Restaurants, Diners",Rudy Martino Original House of Submarines,1918 Monongahela Ave,Pittsburgh,PA,15218,5.0,9,1,American
FJoXrkLaLh76MgHXKdJJFw,"American (Traditional), Nightlife, Bars, Restaurants",Someone Else's Bar,3841 Willow Ave,Pittsburgh,PA,15234,4.0,69,1,American
2EhBiUnUTl_H2s4DXdKCTg,"Bistros, American (New), Restaurants",Bistro 19,711 Washington Rd,Pittsburgh,PA,15228,4.0,163,1,American
MfgewgMdqCx_JWk--6PgfA,"Nightlife, Bars, Burgers, American (Traditional), Restaurants",Kretzler's Tavern,2240 Babcock Blvd,Pittsburgh,PA,15237,3.0,59,1,American
cfjkP0icF3wdaOJQJUy9sw,"Fast Food, Restaurants, Burgers",Wendy's,5422 Baum Blvd,Pittsburgh,PA,15232,2.0,37,1,American
X2lgI8CuVEsH5UDs14rMhw,"Bars, Nightlife, Restaurants, Jazz & Blues, Cocktail Bars, Wine Bars, Arts & Entertainment",Andys Wine Bar,510 Market Street,Pittsburgh,PA,15222,3.5,61,1,American
gomzC2CMt6MD_ykOSGwdDA,"Restaurants, Japanese, Sushi Bars",Sushi Tomo,4812 McKnight Rd,Pittsburgh,PA,15237,4.0,117,1,Japanese
aHuGV6FS0j8_1_p9vFeNuA,"Mexican, Restaurants",Cinco,1600 Painters Run Rd,Pittsburgh,PA,15243,3.0,42,0,Mexican
h5PKBY4jvOwuyYb5Dtr6jA,"Restaurants, Event Planning & Services, Chicken Wings, Fast Food, Caterers",Chick-fil-A,120 Andrew Dr,Pittsburgh,PA,15275,4.0,34,1,American
wdwODzBChLIh_u8V8CPpyA,"Mexican, Restaurants, Caribbean",Casa Rasta,2056 Broadway Ave,Pittsburgh,PA,15216,3.5,107,0,Caribbean
uNBVnx12y-cRYSxukmTfnQ,"Food, Restaurants, Cafes, Juice Bars & Smoothies, Salad",Fresh Healthy Cafe,100 Robinson Ctr Dr,Pittsburgh,PA,15205,4.0,18,1,American
Yh-3IjAFCgq1Ubtdo9TDcw,"Halal, Vegan, Sandwiches, Vegetarian, Ethnic Food, Greek, Middle Eastern, Restaurants, Specialty Food, Mediterranean, Food",Leena's Food,121 Oakland Ave,Pittsburgh,PA,15289,4.0,30,0,Mediterranean
VFv7NcPW9ajUTLleJ8wOQA,"Mexican, Fast Food, Restaurants",Chipotle Mexican Grill,3615 Forbes Ave,Pittsburgh,PA,15213,3.5,65,1,Mexican
s5XqvAOIepm0Pw8mAf27lw,"Restaurants, Bars, American (Traditional), Nightlife",Mt Troy Inn,2021 Mount Troy Rd,Pittsburgh,PA,15212,4.0,5,1,American
xRRDXfZL4V2-I7i2JLnpIA,"American (Traditional), Restaurants",1889 Cafe,2017 E Carson St,Pittsburgh,PA,15203,3.0,10,0,American
LtPnsCPkCb41VG5fQr18IQ,"Restaurants, Pizza",Little Caesars,5430 Centre Ave,Pittsburgh,PA,15232,2.0,11,0,American
ocZv9DHZaf9tkJyzxL5tbg,"Italian, Pizza, Restaurants",Pasta II,718 Brookline Blvd,Pittsburgh,PA,15226,3.5,6,0,Italian
jO9gbncmBCExL_FvFKU5Ew,"Food, Food Delivery Services, Pizza, Restaurants, American (New)",The Grateful Deli & Catering Company,4065 Penn Ave,Pittsburgh,PA,15224,4.0,8,0,American
lSxAQR1FeSljX9zeVJTEWA,"Restaurants, Chinese",Silver Palace Chinese Restaurant,2739 Library Rd,Pittsburgh,PA,15234,3.5,14,0,Chinese
ry9MaSq_tpNODhYoIyA42Q,"Food, Wine Bars, Coffee & Tea, Grocery, Sandwiches, American (New), Bars, Nightlife, Restaurants",Market St Grocery,435 Market St,Pittsburgh,PA,15222,4.0,57,1,American
um9n7JDaPaO1kmgs0cLjqQ,"Hotels & Travel, American (Traditional), Bed & Breakfast, Restaurants, Breakfast & Brunch, Salad, Comfort Food, American (New)",Bob Evans,7412 Mcknight Rd,Pittsburgh,PA,15237,3.5,19,1,American
pFUFVB0cPY2wL0Gr4vL3GA,"Italian, Restaurants, American (New)",Gaetano's Restaurant,1617 Banksville Rd,Pittsburgh,PA,15216,2.0,3,1,Italian
30Bvo-tEfvh2KOTLQg6FZw,"Sandwiches, Fast Food, Restaurants",Subway,3707 Forbes Ave,Pittsburgh,PA,15213,3.5,4,1,American
y19xFolCozaRA-gGmHwkQA,"Vegetarian, Middle Eastern, Food, Restaurants, Mediterranean",Aladdin's Eatery,929 Freeport Rd,Pittsburgh,PA,15240,4.0,67,1,Mediterranean
mKoi3QV2d45Qm3iWt1aa3w,"Restaurants, Turkish",The Doner Kebab House,424 Semple St,Pittsburgh,PA,15213,3.5,4,0,European
fPivHoeKNFhPKZEKFeoIHg,"Restaurants, Fast Food, Burgers",Wendy's,2237 Noblestown Rd,Pittsburgh,PA,15205,2.5,3,1,American
nlEw8XVhQ5CTEr60xaE4Pg,"Mediterranean, Restaurants, Chicken Wings, Pizza",Ash Kris Pizza,3507 Cable Pl,Pittsburgh,PA,15213,3.5,3,1,Mediterranean
NbkDsQhfK13ATV79TI4OQg,"Restaurants, Mexican, Fast Food",Chipotle Mexican Grill,8870 Covenant Ave,Pittsburgh,PA,15237,3.5,10,1,Mexican
a-iENHYNgMdY65p9tZUj6w,"Italian, Restaurants",Cafe Euro,600 Grant St,Pittsburgh,PA,15219,2.0,4,0,Italian
ZKBUoCqTpwMtmImz64DGyQ,"Restaurants, Chinese, Thai",Hong Kong Express II,529 Ct Pl,Pittsburgh,PA,15219,3.5,8,1,Chinese
eva56motCJcevOwKzyQO1g,"Playgrounds, Community Service/Non-Profit, Tennis, Swimming Pools, Travel Services, Hotels & Travel, Restaurants, Hiking, Visitor Centers, Skating Rinks, Active Life, Beaches, Local Services, Parks, Cafes",Schenley Park Visitors Center,101 Panther Hollow Rd,Pittsburgh,PA,15213,5.0,12,1,American
XrpWb4vB7-1z26OreeCD2w,"Greek, Restaurants",The Simple Greek,431 Market St,Pittsburgh,PA,15222,3.5,81,1,Greek
nWO956JzoKr1uKD3VIkp5A,"Cafes, Restaurants",Au Bon Pain Co,"120 5th Ave, Ste 210",Pittsburgh,PA,15222,3.5,7,0,American
1eJ7yIzSAjwC145fnHD5Xw,"Restaurants, Coffee & Tea, Cafes, Food",Starbucks,1050 Park Manor Blvd,Pittsburgh,PA,15205,2.5,27,1,American
3ZcxnR9YkDVRqqkDJMRWBg,"Restaurants, Hot Pot, Soul Food, American (Traditional)",Simmie's Restaurant,8500 Frankstown Rd,Pittsburgh,PA,15235,4.5,5,1,American
99SN6hku1PToQ2E3-4h8CA,"Food, Ice Cream & Frozen Yogurt, Restaurants, Coffee & Tea",Jitters Cafe,5541 Walnut St,Pittsburgh,PA,15232,4.0,61,1,American
grZ6FnfZoj1pQWElAQve3g,"Restaurants, Fast Food, Burgers",Wendy's,2410 W Liberty Ave,Pittsburgh,PA,15226,2.0,16,1,American
9RiC03-rBMtulA3tS5HUZg,"Restaurants, Seafood",Corky Nolan's Miller's Seafood House,3853 California Ave,Pittsburgh,PA,15212,3.0,20,1,American
bOwvJUb8A9MekXsK_SrftQ,"Pizza, Restaurants",Mineo's Pizza,2350 Noblestown Rd,Pittsburgh,PA,15205,2.0,20,1,American
gc4IkXZ3l7Lcmswcht-_ig,"Pizza, Restaurants",Amo's Pizza,2570 Woodstock Ave,Pittsburgh,PA,15218,2.5,3,0,American
S2icYFHPsV_OSCvbI3YiTg,"American (Traditional), Restaurants",Fresh Corner,"120 5th Ave, Ste 5",Pittsburgh,PA,15222,3.0,5,1,American
FIxZW5OjfBotUouYzyYSjw,"Breakfast & Brunch, Food, Sandwiches, Bagels, Restaurants",Einstein Bros Bagels,1736 Washington Rd,Pittsburgh,PA,15241,2.5,5,0,American
HYwbHY-srAOoH-t337DpMw,"Tapas Bars, Restaurants",Tusca Restaurant,2773 Sidney St,Pittsburgh,PA,15203,2.0,27,0,American
8mcg3eCoh69WqaKKZZF98w,"Fast Food, Hot Dogs, Desserts, American (Traditional), Burgers, Food, Restaurants",BnD'z Burgerz & Dogz,663 Washington Rd,Pittsburgh,PA,15228,3.0,25,0,American
u7fc6_zgJEnEq3rEkC1gBg,"Chinese, Restaurants",Chop Sticks,2018 Murray Ave,Pittsburgh,PA,15217,3.0,4,0,Chinese
NrokuoWJAy_VbMprivfAIA,"Pizza, Restaurants",Molly's Pizza,1525 Potomac Ave,Pittsburgh,PA,15216,3.0,48,1,American
Mv7N0bU56dhtoDP-m2JOow,"American (New), Tapas Bars, Nightlife, Bars, Lounges, Restaurants",Sonoma Grille,947 Penn Ave,Pittsburgh,PA,15289,3.5,307,0,American
oiTq668GwyXo5hMHjdW0kA,"Pubs, Restaurants, Nightlife, Bars, Burgers, American (Traditional)",Stack'd Burgers - Shadyside,728 Copeland St,Pittsburgh,PA,15232,4.0,156,1,American
hzyvL2v97xLzLbLXcdi1uw,"Restaurants, Breakfast & Brunch, Coffee & Tea, French, Food, Creperies, Cafes",Cafe Moulin,732 Filbert St,Pittsburgh,PA,15232,4.0,219,1,French
qXGKYRwCR9SLgLl0g_9o5g,"Cocktail Bars, Restaurants, American (New), American (Traditional), Bars, Nightlife",Bar Louie,240 Station Square Dr,Pittsburgh,PA,15219,2.5,123,0,American
p2X4WdGMsi26t_6hN3Hz4w,"Chinese, Soup, Vietnamese, Restaurants, Asian Fusion",Mekong Restaurant,1429 Potomac Ave,Pittsburgh,PA,15216,3.5,65,1,Asian
jhP9rUsV-KvgHu1n--7Q3w,"Restaurants, Chinese",Khoo's Garden,"1130 Perry Hwy, Ste 26",Pittsburgh,PA,15237,3.5,27,1,Chinese
oITu5Qwnmv0hsEMc21XjXw,Restaurants,The Chef's Table at Quickhatch,372 Butler St,Pittsburgh,PA,15223,4.0,5,0,American
u-Xr6P0dHS5IF3HQEg5KoQ,"Desserts, Food, Pizza, Restaurants, Salad",Vocelli Pizza,4740 Baum Blvd,Pittsburgh,PA,15213,2.5,22,1,American
Zd9VJFJjfaadaJmCMFv-RQ,"Pizza, Mediterranean, Food, Turkish, Food Delivery Services, Restaurants",Ephesus Pizza - Pittsburgh,219 Fourth Ave,Pittsburgh,PA,15222,3.5,115,1,European
_rKz-rQPzUAIZWlUHCKgow,"Fast Food, Burgers, Restaurants, Coffee & Tea, Food",McDonald's,3708 Forbes Ave,Pittsburgh,PA,15213,1.5,20,1,American
uRybQLCYWkC6N19MhaHf_w,"Noodles, Seafood, Restaurants, Taiwanese",Taiwanese Bistro Cafe 33,1711 Shady Ave,Pittsburgh,PA,15217,4.5,205,1,Chinese
b2ZukyGCS7xDlv0ZAlXdYg,"Pizza, Restaurants, Italian, Nightlife, Bars, Cocktail Bars",Alida's Woodfire Cucina,"3345 Penn Ave, Ste 200",Pittsburgh,PA,15201,4.0,38,1,Italian
G-GcMq-iVEENhjG3z1lZhA,"Caterers, Event Planning & Services, Food, Food Trucks, Pizza, Restaurants",Wood Fired Flatbreads,"625 Lowries Run Rd, Ste 200",Pittsburgh,PA,15237,4.5,11,1,American
7HE4yPFbyimzEtVnB_nvzA,"American (Traditional), Bars, Dive Bars, Nightlife, Restaurants",The Jaggerbush,133 S 23rd St,Pittsburgh,PA,15203,3.5,14,0,American
sTmHeHv-4uZRRne5jBDzvA,Restaurants,Si Senor Restaurant,600 Grant St,Pittsburgh,PA,15219,2.0,4,0,American
_iUlt5rm-15QoLw0MEEg5A,"Nightlife, Lounges, Event Planning & Services, Restaurants, Venues & Event Spaces, Bars, American (Traditional)",Mitchell's Pub,304 Ross St,Pittsburgh,PA,15219,3.5,36,1,American
s2s7K5_x-W6gbCvuhtI6lw,"Cafes, Restaurants",Gateway Clipper Cafe,224 W Station Square Dr,Pittsburgh,PA,15219,3.0,6,0,American
OaDijC3QRwxw9uTadyWIsw,"Restaurants, Mexican",Mexico City,2212 E Carson St,Pittsburgh,PA,15203,3.5,3,0,Mexican
KNvqTNhpCq7Sshqzykx9QQ,"Pizza, Restaurants, Italian",Folino Brothers Pizzeria,373 Vanadium Rd,Pittsburgh,PA,15243,4.0,3,0,Italian
PA0UJYogQTd5MIuKMs3tfA,"Restaurants, Greek",It's Greek To Me,1011 Brookline Blvd,Pittsburgh,PA,15226,4.5,21,0,Greek
IBSOhov5GLSZsGzz3ZsQjg,"Event Planning & Services, Restaurants, Comfort Food, Caterers, American (Traditional)",Boston Market,98 Clairton Blvd,Pittsburgh,PA,15236,3.5,3,0,American
MtjOk7u7sp3yWyzscAIG4Q,"Bars, Nightlife, Restaurants, Cuban",Salud,4517 Butler St,Pittsburgh,PA,15201,4.0,41,0,Caribbean
yPcAdikNrXEsfbHNBQUjkQ,"Antiques, Coffee & Tea, Restaurants, Salad, Food, Breakfast & Brunch, Vegetarian, Vegan, Shopping",The Zenith,86 S 26th St,Pittsburgh,PA,15203,4.0,184,1,American
XKOAi4J47i-YEhhHfKkPRQ,"Restaurants, Chinese",China Garden,890 Butler St,Pittsburgh,PA,15223,3.0,9,1,Chinese
8CjI8nebSDB5aINJc3dLwA,"Italian, Restaurants, Pizza",Quattro Pizza,328 Curry Hollow Rd,Pittsburgh,PA,15236,4.0,13,1,Italian
lPljcKGwLlcwkLT5cl0yDg,"Bagels, Sandwiches, Breakfast & Brunch, Restaurants, Food",Bruegger's Bagels,411 Seventh Ave,Pittsburgh,PA,15219,3.0,14,0,American
_PKa6Dj06Q2AHKGkpJ7GnA,"Restaurants, Barbeque, American (New), Soul Food",Z-Best BBQ,1315 5th Ave,Pittsburgh,PA,15219,4.5,38,1,American
p4jRa3qzDJtV-hSjcuNUag,"Nightlife, Bars, Pizza, Restaurants",Pi Coal Fired Pizza,1707 E Carson St,Pittsburgh,PA,15203,3.5,28,0,American
2cfzQGANxuIGcCUrlwnV7w,"Fast Food, Chicken Wings, Restaurants, Southern",Popeyes Louisiana Kitchen,3420 William Penn Hwy,Pittsburgh,PA,15235,2.0,29,1,American
fHH836GXPlnwnJL14ZpGRw,"Burgers, Nightlife, Beer Bar, American (Traditional), Bars, Restaurants",Forbes Tavern,310 Forbes Ave,Pittsburgh,PA,15222,4.5,29,1,American
drquCq18pgKu1lv1UzJJAQ,"American (New), Restaurants, Nightlife, Bars",Siempre Algo,414 E Ohio St,Pittsburgh,PA,15212,5.0,11,1,American
LkcGDfznt-QzjL22fO3F4Q,"Soup, Bars, Burgers, Sandwiches, Restaurants, Nightlife, Food",Stoke's Grill,4771 McKnight Rd,Pittsburgh,PA,15237,3.5,113,1,American
X8AGCsJHw-GuTqkzy2J3cg,"Convenience Stores, American (New), Coffee & Tea, Donuts, Restaurants, Food, Breakfast & Brunch",Bluebird Kitchen,221 Forbes Ave,Pittsburgh,PA,15222,4.0,232,1,American
lJc5WljtIAI6hBqzKbn_HQ,"Restaurants, Pizza, Chicken Wings, Salad",Vocelli Pizza,3060 W Liberty Ave,Pittsburgh,PA,15216,4.0,9,1,American
XxmziAeRqMKwsDjyyjVgeg,"Italian, Nightlife, Restaurants",Zarra's A Taste of Southern Italy,3887 Bigelow Blvd,Pittsburgh,PA,15213,3.5,101,1,Italian
bSdLGMzfyNa5PcwH_00_CQ,"Pizza, Burgers, Restaurants, Breakfast & Brunch",Jack's Pizza & Hoagies,3565 Harts Run Rd,Pittsburgh,PA,15238,3.5,3,1,American
bLva9YGmDcnar3YKHE2XzA,"Ice Cream & Frozen Yogurt, Food, Restaurants",Tutti Frutti Frozen Yogurt,5874 Forbes Ave,Pittsburgh,PA,15217,3.5,31,0,American
xjTZe_vgnlnsEUGHfQiOIw,Restaurants,Lydia's Place,"710 5th Ave, Ste 2100",Pittsburgh,PA,15219,3.5,5,1,American
PNl8R1SmXXgGU2ThG0qVbg,"American (Traditional), American (New), Restaurants",Georgetowne Inn,1230 Grandview Ave,Pittsburgh,PA,15211,2.0,45,0,American
8cyyRk-cqecyB1ctnRsR1A,"Bistros, Restaurants, American (New)",Lola Bistro,1100 Galveston Ave,Pittsburgh,PA,15233,4.5,60,1,American
EJFdWX908N8Yc2XG0Lky8A,"Restaurants, Cafes",River Moon Cafe,104 43rd St,Pittsburgh,PA,15201,4.0,5,0,American
iXnHrmTw-r6LNzC2MjjrWQ,"Caribbean, Restaurants, Mexican",Casa Rasta,2102 Broadway Ave,Pittsburgh,PA,15216,4.5,25,0,Mexican
xA6L2w_TlbxHubb1xeBE8w,"Food, Pakistani, Indian, Restaurants, Bakeries",Tamarind Savoring India,2101 Greentree Rd,Pittsburgh,PA,15220,4.0,156,1,Indian
PF8HqToO6An0mH6odFoCEw,"Food Court, Fast Food, Restaurants, Sandwiches, Steakhouses",South Philly Steak & Fries,301 S Hills Village,Pittsburgh,PA,15241,2.5,9,1,American
ygb8qHro6-EHNWevravotQ,"Noodles, Restaurants, Vietnamese, Vegan",Tan Lac Vien Express,256 N Craig St,Pittsburgh,PA,15213,4.0,8,1,Vietnamese
Chr3YCuvt2mD-BHgqeo-OA,"Specialty Food, Ethnic Food, Restaurants, Latin American, Peruvian, Food",Chicken Latino,155 21st St,Pittsburgh,PA,15222,4.0,184,1,LatinAmerican
zxSfGIhK3hH3vVz_pS5eaA,"Food, Halal, Food Delivery Services, Wineries, Bars, Restaurants, Nightlife, Arts & Entertainment, Indian, Pakistani",Yuva India Kitchen + Bar,412 S Craig St,Pittsburgh,PA,15213,3.0,121,1,Asian
EWJbWp3oOwDsv4Lo5eZWxw,"Pizza, American (Traditional), Diners, Breakfast & Brunch, Restaurants",Drew's Family Restaurant,2060 Ardmore Blvd,Pittsburgh,PA,15221,4.0,83,1,American
oXFRaSgcT9GwCWfC9lf8dg,"Restaurants, Pizza",Pizza Italia,4512 Liberty Ave,Pittsburgh,PA,15224,4.0,62,1,American
lRB4EvPM0L88f4meH9KcYQ,"Restaurants, Desserts, Food, Ice Cream & Frozen Yogurt, American (Traditional), Sandwiches",Peanut Butter Jelly Time,4709 Liberty Ave,Pittsburgh,PA,15224,4.0,46,0,American
R4i5FshghtTnTZC8EEbjHQ,"Restaurants, Vegetarian, Gluten-Free, Fast Food",Freshii,501 Grant St,Pittsburgh,PA,15219,4.5,37,1,American
c0yPNU-BqS65u0vIKP7P0w,"American (New), Restaurants",Avenue B,5501 Centre Ave,Pittsburgh,PA,15232,4.0,228,0,American
uXft-y53ujmlAt0SH-5KYg,"Diners, Coffee & Tea, Breakfast & Brunch, Sandwiches, Greek, Burgers, Restaurants, Food",Lindos Restaurant,947 Western Ave,Pittsburgh,PA,15233,3.5,48,1,Greek
F-lfG2IBiICdSxoHYmi-Vg,"Restaurants, Italian",Common Plea Restaurant,308 Ross St,Pittsburgh,PA,15219,3.5,8,0,Italian
CQbxcD7b6SjBwk7EOA0PcQ,"Real Estate, Apartments, Restaurants, Event Planning & Services, Hotels, Hotels & Travel, Home Services",Extended Stay America - Pittsburgh - Airport,200 Chauvet Dr.,Pittsburgh,PA,15275,2.0,13,1,American
uE6hI5_i4QVq12xU99xtqA,"Pizza, Restaurants",Fazio's Pizza,4028 Penn Ave,Pittsburgh,PA,15224,4.0,64,1,American
aXr_1TUkow7ef7ddrd7kYA,"Hotels & Travel, Restaurants, American (New)",Palm Court,530 William Penn Pl,Pittsburgh,PA,15219,3.5,3,1,American
gn8cZOxQIZNUeiHcJ0WxMQ,"American (New), Restaurants",Max & Erma's Restaurants,5533 Walnut St,Pittsburgh,PA,15232,3.0,6,0,American
N56-LiN3xp3xEQbl0oRHjg,"Southern, Restaurants",Nana's Place By Gibsons,4510 Liberty Ave,Pittsburgh,PA,15224,4.0,5,1,American
pGwfOqNEL8FbMUFspJdAMA,"Restaurants, Mexican",Patron Mexican Grill,133 S Highland Ave,Pittsburgh,PA,15206,3.5,126,1,Mexican
atE68d1gSZf3849yIGLBJw,"Chinese, Restaurants",Northeastern Kitchen,5824 Forbes Ave,Pittsburgh,PA,15217,4.0,10,1,Chinese
zV-MIXhL1atiHTc1P1HRRA,"Comfort Food, American (Traditional), Restaurants",Pittsburgh Poultry Company,411 Cherry Way,Pittsburgh,PA,15219,4.0,10,0,American
2xBIQyPr3Bp5YPgLScMSgg,"American (Traditional), Restaurants",Golden Corral of Pittsburgh,900 Park Manor Blvd,Pittsburgh,PA,15205,3.0,44,1,American
QzoHxxiHH1HDOATbMK4odw,"Sandwiches, Delis, Grocery, Restaurants, Food",Giant Eagle,1165 McKinney Ln,Pittsburgh,PA,15220,2.5,11,1,American
#NAME?,"Restaurants, Indian, Caterers, Event Planning & Services",Desi Moorgi,4903 Baum Blvd,Pittsburgh,PA,15213,4.0,4,0,Indian
9cgrssqswYBSpvBAKc1-nQ,"Fast Food, Salad, Restaurants, Sandwiches, Delis",Subway,1035 Fifth Ave,Pittsburgh,PA,15219,2.5,7,1,American
p0hfV1YC5KB3Np5mek3TbQ,"Restaurants, Fast Food, Delis, Sandwiches",Jimmy John's,1717 E Carson St,Pittsburgh,PA,15203,2.5,15,1,American
78zibwl7zb6sekh4bG8g8g,"Restaurants, American (New)",The Underground,1060 Morewood Ave,Pittsburgh,PA,15213,3.5,3,1,American
7hiJOyqQ14u6IkYQ40SQUg,"Music Venues, Bars, Lounges, Cafes, Restaurants, Nightlife, Arts & Entertainment",AVA Cafe + Lounge,304 N Craig St,Pittsburgh,PA,15213,4.0,7,0,American
64Pj9JV8jPOizCKpFI7Y2g,"Restaurants, Mexican",El Lugar,200 Children's Way,Pittsburgh,PA,15212,4.0,6,1,Mexican
dFO-m5EkCYXr3kztC1d1aA,"Italian, American (Traditional), Restaurants, Bars, Nightlife",Rum Runners,3385 Babcock Blvd,Pittsburgh,PA,15237,3.0,66,0,Italian
9_LwnUarlbKkTbVvP9FRdw,"Uzbek, Restaurants",Diyor Cafe and Lounge,14 Smithfield St,Pittsburgh,PA,15222,2.0,3,0,American
6U5QlK84UmPUgoJAwAcL9Q,"Restaurants, Mexican",California Taco Shop,2760 Saw Mill Run Blvd,Pittsburgh,PA,15227,3.5,29,0,Mexican
Aes4MuZLnFqglFJNMZxRbw,"Specialty Food, Imported Food, Food, African, Ethnic Food, Coffee & Tea, Restaurants",Lydiah's Coffee House,200 Grant St,Pittsburgh,PA,15219,4.5,27,0,African
q3KkavNYpcsgbdfeImYzKw,"Restaurants, Nightlife, Lounges, Bars, American (New)",Bellfarm,1111 Airport Blvd,Pittsburgh,PA,15231,3.5,18,1,American
WnuRPyTEvILZKCAPk2UwYQ,"Burgers, Fast Food, Restaurants",Wendy's,725 Allegheny Ave,Pittsburgh,PA,15233,2.5,10,1,American
scIbMKZIigMz4w5Q2SltTg,"Bars, Nightlife, Restaurants, Sports Bars, Buffets, American (Traditional), Lounges",Carson City Saloon,1401 E Carson St,Pittsburgh,PA,15203,3.5,45,1,American
Zs-Gk02SPk_CU7NgMAVTJw,"Coffee & Tea, Cafes, Restaurants, Food, Coffee Roasteries, Desserts",Coffee Tree Roasters,48 Fox Chapel Rd,Pittsburgh,PA,15238,3.5,23,1,American
6V8D6uCQ-ChFap59Fc-ZoA,"American (New), Bars, Restaurants, Burgers, Cafes, Nightlife",Coach's Bottleshop & Grille,3105 Banksville Rd,Pittsburgh,PA,15216,3.5,41,1,American
lYSV7xI8lhO76kZs-z2MOw,"Specialty Food, Breakfast & Brunch, Food, Restaurants",Waffle Shop,124 S Highland Ave,Pittsburgh,PA,15206,3.5,14,0,American
5CjdVHY504ccwZ2n3uyPOA,"Food, Burgers, Restaurants, Coffee & Tea, Fast Food",McDonald's,549 Clairton Blvd,Pittsburgh,PA,15236,1.5,3,1,American
462vn0tiPlmWRcP71yYOTQ,"Restaurants, Japanese, Sushi Bars",Tsuki Japanese,11655 Frankstown Rd,Pittsburgh,PA,15235,4.0,42,0,Japanese
