business_id,categories,name,address,city,state,postal_code,stars,review_count,is_open,TypeCusine
x_AmiOc8DPAyHe5VeoDYEw,"Burgers, Steakhouses, Restaurants, American (Traditional), Sports Bars, Nightlife, Bars",Applebee's Grill + Bar,"1601 S Braddock Ave, Edgewood Towne Centre",Pittsburgh,PA,15218,2.5,26,1,American
a6iD1btU3fo6P6UV-YFLsw,"Nightlife, Tapas/Small Plates, Lounges, Mediterranean, Restaurants, Bars",Truth Lounge,51 S 12th St,Pittsburgh,PA,15203,3.5,27,0,Mediterranean
9cQ5nhSJJJ9tWDn119QAEA,"Restaurants, Bars, Nightlife",Satalio's Inc,27 Bailey Ave,Pittsburgh,PA,15211,4.5,5,1,American
KBBXaD0FXDTpFuTuSJ6yHA,"Sandwiches, Sports Bars, Chicken Wings, Bars, Nightlife, Burgers, Steakhouses, American (Traditional), Restaurants",Applebee's Grill + Bar,3440 William Penn Hwy,Pittsburgh,PA,15235,2.5,27,1,American
z4EIzLJlGd7gyje1Q_hKtw,"Pizza, Restaurants, American (New), Mexican",Federal Galley,200 Children's Way,Pittsburgh,PA,15212,4.0,163,1,Mexican
2YA_V5NMOQ3vBwyMKtQ95Q,"Dinner Theater, Restaurants, Nightlife, Comedy Clubs, Performing Arts, Arts & Entertainment",The Dinner Detective,530 William Penn Pl,Pittsburgh,PA,15219,3.5,6,1,American
pAqgiVcOY5mPouuEW96R0g,"Bars, Food, American (Traditional), Arts & Entertainment, Dance Clubs, Nightlife, Cocktail Bars, Music Venues, Gay Bars, Pizza, Restaurants",Cattivo,146 44th St,Pittsburgh,PA,15201,3.5,27,1,American
kJQbc861Qvm_HsNofAahDA,"Restaurants, Burgers, Fast Food, Food, Hot Dogs",Five Guys,3 Ppg Pl,Pittsburgh,PA,15222,3.5,23,1,American
5RVbdMA1oVz7GCOIwn1Z3Q,"Restaurants, Sandwiches",Peppi's,7619 1/2 Penn Ave,Pittsburgh,PA,15221,4.0,22,1,American
B-myMqxqAYvU1G0DA-O7SQ,"Mediterranean, Food Delivery Services, Restaurants, Italian, Pizza, Food",Angelina's Pizzeria,3263 W Liberty Ave,Pittsburgh,PA,15216,4.0,4,0,Italian
GwcWB_uDN6ppuk_V8x7iww,"American (Traditional), Diners, Restaurants, Breakfast & Brunch",Nicky's Grant Street,"310 Grant St, Ste 100",Pittsburgh,PA,15219,4.0,5,1,American
fxZOOJtT6Zau7Asmppigkg,"Event Planning & Services, Caterers, Italian, Food, Greek, Restaurants, Pizza, Food Delivery Services, Sandwiches",Potenza Pizza and Pasta,4709 Centre Ave,Pittsburgh,PA,15213,3.0,36,1,Greek
lzjnPNA1ALVpWCo_ygRatw,"Hot Dogs, Restaurants, American (New), Food",Nathan's Famous,305 Wood St,Pittsburgh,PA,15222,3.0,5,0,American
ztbLCSo15CMqt18D6f0x5A,"Restaurants, Italian",Lilly's Gourmet Pasta Express,5860 Forbes Ave,Pittsburgh,PA,15217,2.5,10,0,Italian
CS3ykvbERsTrVxL9HPoCOw,"Mexican, Fast Food, Restaurants",Chipotle Mexican Grill,1720 Washington Rd,Pittsburgh,PA,15241,2.5,20,1,Mexican
D2nfOrnJ2OBlX_428sKyMg,"Italian, Comfort Food, Restaurants, Noodles, American (New), Mediterranean, Asian Fusion",Noodles & Company,476 McMaster Way,Pittsburgh,PA,15222,3.0,84,1,Asian
vfdoTS7wDNjK0ZV2ngPp0w,"Greek, Middle Eastern, Mediterranean, Breakfast & Brunch, Restaurants",Gypsy Cafe,1330 Bingham St,Pittsburgh,PA,15289,4.0,20,0,Mediterranean
H5PdoEWleg9uDU67ZAy6JA,"Arts & Entertainment, Food, Restaurants, Vegan, Venues & Event Spaces, Music Venues, Cocktail Bars, Event Planning & Services, Lounges, Juice Bars & Smoothies, Cafes, Coffee & Tea, Dance Clubs, Nightlife, Bars",Mixtape,4907 Penn Ave,Pittsburgh,PA,15224,4.5,52,1,American
KSw3FAh5d5Q3PdFO1Gevmw,"Fast Food, Restaurants, Diners",Steel City Diner,961 Liberty Ave,Pittsburgh,PA,15289,3.0,5,0,American
1M6tA3TqxcpptHW0_hP9Kw,"Restaurants, Vegetarian, Nightlife, Bars, Arts & Entertainment, Dive Bars, Vegan, Music Venues",Brillobox,4104 Penn Ave,Pittsburgh,PA,15224,3.5,157,1,American
5cWPgytHCuPq0poBz7r5sw,"Restaurants, Pizza",Jb's Pizza Place,2513 Transport St,Pittsburgh,PA,15234,3.0,4,1,American
aAkoJKozYZEyBx58wQ-UrQ,"Restaurants, Food, Smokehouse, Barbeque, Hair Salons, Beauty & Spas",Jabo's Smoke House and Saloon,4428 Liberty Ave,Pittsburgh,PA,15224,3.5,80,0,American
j5TMmDVFNkoq629hS_78Gw,"Restaurants, Nightlife, Beer, Wine & Spirits, Food, American (New), Bars",PJ's Grille & Bar,164 Fort Couch Rd,Pittsburgh,PA,15241,2.0,7,0,American
Ku4iZZ9hvKHd2u2yzoFj0A,"Food Delivery Services, Food, Local Flavor, American (New), Restaurants",Muscle Maker Grill,2767 E Carson St,Pittsburgh,PA,15203,2.5,15,0,American
tQRcO-C-5gZxxUo9lHbexg,"Breakfast & Brunch, Restaurants, American (New)",Pie For Breakfast,200 North Craig St,Pittsburgh,PA,15213,4.0,67,1,American
T94qlaU0F25I44GuQsxJew,"Restaurants, American (New)",Isabela On Grandview,1318 Grandview Ave,Pittsburgh,PA,15211,4.0,81,0,American
heYShXdxU_RVoDcGGGkn5Q,"American (Traditional), Cafes, Restaurants",Smithfield Cafe,639 Smithfield St,Pittsburgh,PA,15222,3.5,17,0,American
9eqZNBLnNycOWQ2wQEwulQ,"Bars, Restaurants, American (Traditional), Gastropubs, Cocktail Bars, Pizza, Nightlife, Dance Clubs",The Flats on Carson,1500 E Carson St,Pittsburgh,PA,15203,3.0,30,1,American
VveJgvCshJios_o-zwKJIw,"Fast Food, Tex-Mex, Restaurants, Mexican",Taco Bell,705 Allegheny Avenue,Pittsburgh,PA,15233,2.0,11,1,Mexican
rc9SfYli96cnlPDMyJ7hyA,"Steakhouses, American (Traditional), Restaurants, American (New), Barbeque",LongHorn Steakhouse,9150 Covenant Ave,Pittsburgh,PA,15237,3.5,33,1,American
hODnmsq1kK6eA0VLbFQOVw,"Nightlife, Gluten-Free, Restaurants, Bars, Italian, Cocktail Bars",BRAVO! Cucina Italiana,4976 McKnight Rd,Pittsburgh,PA,15237,3.0,64,1,Italian
_QkGfsQaQbuyUf-hy_2muw,"Restaurants, Pizza",Original Milano's Pizza East Side,6004 Centre Ave,Pittsburgh,PA,15206,3.5,14,0,American
LkPQmCF3k6iDqBLY7bsE5Q,"Nightlife, Pubs, Bars, Food, Beer, Wine & Spirits, Restaurants",The Blind Pig,2210 E Carson St,Pittsburgh,PA,15203,4.5,18,0,American
MU8xA_S8gqobnDq8d2nsQg,"American (New), Restaurants",Damon's Grill & Sports Bar,5205 Campbells Run Rd,Pittsburgh,PA,15277,2.5,3,0,American
fC9g9BIyb0GTQFqnE38beA,"Restaurants, Hot Dogs",My Dogz on the Run,Four Gateway Ctr,Pittsburgh,PA,15222,5.0,3,1,American
Fa2gj48WwaEPuKW_Lj9MwQ,"Soul Food, Restaurants, Chicken Wings, Seafood",Hook Fish & Chicken,11 Ormsby Ave,Pittsburgh,PA,15210,3.0,15,1,American
8FuzQ8WN5WKpBbyT2wBlYA,"Sandwiches, Burgers, Restaurants, American (Traditional)",The Elbow Room,5744 1/2 Ellsworth Ave,Pittsburgh,PA,15232,3.5,31,0,American
d6zooCvFxThM1SGye7JJfQ,"Delis, Sandwiches, Restaurants",Campus Deli,400 Semple St,Pittsburgh,PA,15213,3.0,28,1,American
SrzJZMB_WXFAAzBdipKOWw,"Restaurants, Italian",Abruzzi's,20 S 10th St,Pittsburgh,PA,15203,4.5,3,0,Italian
9vaCqmQ56EtUyj6PV8_D8A,"Restaurants, Mexican, Vegetarian",Rey Azteca,11655 Frankstown Rd,Pittsburgh,PA,15235,4.0,5,0,Mexican
kiz4xELBxC8tQtr4uBtM3A,"Burgers, Sandwiches, Restaurants, Greek",Tom's Diner,2937 W Liberty Ave,Pittsburgh,PA,15216,3.5,67,1,Greek
wJ4lFz3o1HGJ4wNCCsQTQQ,"Shopping, Restaurants, Cafes",The Zone,5217 Butler St,Pittsburgh,PA,15201,2.5,4,0,American
HPX1pRtWInt_UVtfld-zsQ,"Food, Bakeries, Restaurants, Coffee & Tea, Cafes",Chateau CafÃ© & Cakery,"1501 Preble Ave, Fl 1",Pittsburgh,PA,15233,4.0,49,1,American
Zz2AwpjN3HA1-L_XUC5R9g,"Food, Restaurants, Food Trucks, Pizza",Driftwood Oven,3615 Butler St,Pittsburgh,PA,15201,4.5,62,1,American
kGGsHP9mfcxtofiswy7ItQ,"Soup, Restaurants, Breakfast & Brunch, Coffee & Tea, Bagels, Food, Bakeries, Salad, Sandwiches",Panera Bread,1900 Greentree Rd,Pittsburgh,PA,15220,3.0,33,1,American
AZ_iSVHQdBiCTnMolLTg3Q,"Chinese, Asian Fusion, Buffets, Restaurants",China Buffet,6401 Penn Ave,Pittsburgh,PA,15206,2.0,10,1,Asian
vSXum5CZEgnouVyPo5BTWA,"Burgers, Gluten-Free, Restaurants, Salad, Sandwiches, Pizza",Pizza 412,2080 Saw Mill Run Blvd,Pittsburgh,PA,15210,2.5,29,1,American
#NAME?,"Food Delivery Services, Food, Pizza, Restaurants, Sandwiches",Sola Pizza,1417 E Carson St,Pittsburgh,PA,15203,3.5,32,1,American
MPjwZL8DHKCEbFw8LYiAIA,"Fast Food, Sandwiches, Restaurants",Subway,1343 W Liberty Ave,Pittsburgh,PA,15226,3.0,3,1,American
5oc3Jva4wWS4O44a-0Jd8Q,"Bakeries, Restaurants, Food, Pizza",Bread and Salt,330 Pearl St,Pittsburgh,PA,15224,3.5,42,0,American
VvMdpGdwnUCSmWYkNeMDJQ,"American (Traditional), Restaurants, Event Planning & Services, Venues & Event Spaces, American (New), Lounges, Bars, Nightlife",Lexus Club at PNC Park,115 Federal St,Pittsburgh,PA,15212,4.0,27,1,American
gAe_dOlcAd6tEXDUXNiwOA,"Chicken Shop, Restaurants",Bird On The Run,128 S Highland Ave,Pittsburgh,PA,15206,4.5,112,1,American
9ScF7Bl_XXKBMjawtuBvNQ,"Restaurants, Cuban",Black Bean Cuban Cuisine,239 Atwood St,Pittsburgh,PA,15213,3.0,21,0,Caribbean
9YhEuxUPnqadrG58ewa2Dg,"American (New), Restaurants",Fish Nor Fowl,5523 Penn Ave,Pittsburgh,PA,15206,4.0,22,1,American
HmI9nhgOkrXlUr6KZGZZew,"Sandwiches, Italian, Food, Mexican, Breakfast & Brunch, Restaurants, Diners",Rocky's,4759 Liberty Ave,Pittsburgh,PA,15224,3.0,16,1,Mexican
uqNCIsAUgH0YxIXq5BWYTA,"Delis, Sandwiches, Restaurants",Quiznos,300 S Craig St,Pittsburgh,PA,15213,3.5,20,1,American
0OkfU0vDBprsIEd5hWuhAQ,"Restaurants, Sandwiches, Food, American (New), Desserts",Simple Gourmet,2203 1/2 Ardmore Blvd,Pittsburgh,PA,15221,5.0,41,0,American
NcNzTKVatkbRkD_G8A891A,"Thai, Restaurants, Tapas Bars",Silk Elephant,1712 Murray Ave,Pittsburgh,PA,15217,3.5,216,1,American
oi4dg_m1NBpXRDQN3qkN9Q,"Food, Restaurants, Bakeries",Au Bon Pain Co,535 Smithfield St,Pittsburgh,PA,15222,3.0,7,1,American
zG9306XlgO9EyIhSpBBw0Q,"Restaurants, Burgers, Fast Food",Burger King,909 Butler St,Pittsburgh,PA,15223,1.5,3,1,American
hHgSUnDB9yIrxUEMSmsdoQ,"Salad, Restaurants, Italian, Wraps",Piada Italian Street Food,3600 Forbes Ave,Pittsburgh,PA,15213,4.0,193,1,Italian
s36Rk0jd78z75LaqifnU3Q,"Restaurants, Mexican",Rey Azteca,3448 William Penn Hwy,Pittsburgh,PA,15235,4.0,89,1,Mexican
LdJljAqDu3UcIZldHcvJSQ,"Restaurants, Mexican",Emiliano's Restaurante & Cantina,8600 McKnight Rd,Pittsburgh,PA,15237,3.0,18,0,Mexican
9j3Lcsbng3Zx3f069S3d1A,"Restaurants, Sandwiches, Fast Food",Subway,1039 Freeport Rd,Pittsburgh,PA,15238,2.0,4,1,American
v84O7YwkMuwIH8xReJ0xYg,"Pizza, Restaurants, Italian",Papa John's,11700 Frankstown Rd,Pittsburgh,PA,15235,2.0,10,1,Italian
mG5gV8OWUTp21vLQqmoFFQ,"Sandwiches, Restaurants",Uncle Sam's Submarines,210 Oakland Ave,Pittsburgh,PA,15213,4.0,96,0,American
mdKSq2mfp1M8tfbjmbyv4Q,"Food, Specialty Food, Bakeries, Restaurants, Cafes",Loafers Bread Co,1153 Freeport Rd,Pittsburgh,PA,15238,4.0,8,1,American
xIhvXZPel8MZ4NFzoqGYxg,"Hot Dogs, Burgers, Restaurants, Food Trucks, Food",BullDawg's,317 S Evaline,Pittsburgh,PA,15224,4.0,8,1,American
M9JpXoyxm_ZFY1zVmHgwTA,"Cafes, Restaurants",Au Bon Pain,347 6th Ave,Pittsburgh,PA,15229,3.5,7,1,American
HuJL373IQ-rrTPKMpa6iww,"Restaurants, American (Traditional), Bars, Nightlife",Bruceton Station,1152 Cochrans Mill Rd,Pittsburgh,PA,15236,2.5,3,0,American
g6OnbXvrky8HTtRFWVL_bQ,"Restaurants, Fast Food",KFC,45 Foster Ave,Pittsburgh,PA,15205,1.5,3,0,American
MYyJ9orpiRq0prjVq4ku7w,"Italian, Pizza, Chicken Wings, Restaurants",Pizza Fiesta,14 Smithfield St,Pittsburgh,PA,15222,3.0,49,1,Italian
1YC7AbQMlNb5mLUlwwaa3w,"Pizza, Chicken Wings, Barbeque, Beer Bar, Nightlife, Restaurants, Bars",Bites and Brews,5750 Ellsworth Ave,Pittsburgh,PA,15232,3.5,85,0,American
Lyn5sYu1rfxdmntbaOoZJg,"Nightlife, Restaurants, Sports Bars, Casinos, Steakhouses, Bars, Arts & Entertainment",Rivers Casino,777 Casino Dr,Pittsburgh,PA,15212,3.0,237,1,American
RBiTzpD2em9zKwKTMNFoZQ,"Burgers, Fast Food, Restaurants",BRGR,115 Federal St,Pittsburgh,PA,15212,1.0,4,1,American
_R1jBQQieKpNGMBqmrLRyA,"Restaurants, Cajun/Creole",NOLA,24 Market Sq,Pittsburgh,PA,15222,3.5,505,1,American
IcrFc5IwCcKyGbVmgWjVjg,"Restaurants, Chinese",Red Dragon,213 S Highland Ave,Pittsburgh,PA,15206,3.5,9,1,Chinese
xCcg7KsIxRpYp0-Hxo0prw,"Restaurants, Italian",La Cucina Flegrea Regional Italian Cuisine,2114 Murray Ave,Pittsburgh,PA,15217,3.0,6,0,Italian
PeATTp15Y_ExaN6mR1dmKw,"Restaurants, Steakhouses, Chicken Wings, Nightlife, Bars, American (Traditional), Sports Bars",Quaker Steak & Lube,110 Andrew Dr,Pittsburgh,PA,15275,3.0,111,1,American
fE9qwymLDKUvTXiF99jNNQ,"Lounges, Nightlife, Bars, Restaurants, American (Traditional)",One 10 Lounge,110 Smithfield St,Pittsburgh,PA,15222,3.0,4,0,American
8dAmtiVtZjiRTmDq9QAW5w,"Middle Eastern, Mediterranean, Lebanese, Restaurants",Kabob-G Grill,3821 Willow Ave,Pittsburgh,PA,15234,4.5,59,1,Mediterranean
toc31C-Qy2smSq0A7Q8FgA,"Chinese, Soup, Breakfast & Brunch, Restaurants, Noodles",China Lin,5500 Butler St,Pittsburgh,PA,15201,3.5,27,1,Chinese
WBwB_ydYDNHwwd5U2U8UvQ,"Restaurants, Fast Food, Food, Food Delivery Services, Sandwiches, Delis",Jimmy John's,1027 Penn Ave,Pittsburgh,PA,15222,3.0,12,1,American
T-4MZRvKlF3VLDcjCqqFEg,"Restaurants, Asian Fusion",Pan Asian,3519 Butler St,Pittsburgh,PA,15201,3.5,92,0,Asian
yGwEJqqI9oLsRuliqDRAlg,"Delis, Convenience Stores, Breakfast & Brunch, Restaurants, Food, Diners, Pizza, Burgers",Shop-n-Go Deli,6001 Buttermilk Hollow Rd,Pittsburgh,PA,15207,4.5,11,1,American
yo6Ewp9hobvoHbIPXlpRzg,"Food, Sandwiches, Restaurants, Specialty Food, Bagels, Delis",Bagel Factory,5885 Forbes Ave,Pittsburgh,PA,15217,2.5,107,1,American
eC-duRpbiVsCD14oGYiDOA,"Asian Fusion, Restaurants, Chinese, Sushi Bars, Japanese, Thai",Restaurant Hana,4407 Butler St,Pittsburgh,PA,15201,4.0,23,0,Japanese
GGEeGKUez_pGqYXtk-sKvQ,"Breakfast & Brunch, Restaurants, Diners, American (Traditional)",Kelly O's Diner,2400 Smallman St,Pittsburgh,PA,15222,4.0,211,1,American
D60IfSLfKA32Et3cvR-t3A,"Diners, Restaurants",Bob's Diner,1870 Painters Run Rd,Pittsburgh,PA,15241,3.5,51,1,American
FsDogwXYckKUgs5VUoPbJw,"Sandwiches, Restaurants, Chicken Wings, Pizza",Frisch's,5301 Grove Rd,Pittsburgh,PA,15236,3.5,38,1,American
ym7uH6ZpCfKQ1Of7eaYGCA,"Restaurants, Pizza",Donte's Pizzeria,6409 Brownsville Rd,Pittsburgh,PA,15236,4.0,43,1,American
gu_yLQWygwzkwBOCpSj-Kg,"Wraps, Burgers, Pizza, Restaurants",Azimers Pizza Place,346 Atwood St,Pittsburgh,PA,15213,4.0,13,1,American
EDyR9OIMV6reKmqdPTRJvw,"Hotels & Travel, Event Planning & Services, Restaurants, Hotels, Venues & Event Spaces",Holiday Inn,100 Lytton Ave,Pittsburgh,PA,15213,2.5,24,0,American
FZpyIiCAsr7Twkw4tQeqPA,"Nightlife, Salad, Restaurants, Italian, Bars, Wine Bars",Olive Garden Italian Restaurant,40 McIntyre Square Dr,Pittsburgh,PA,15237,3.0,43,1,Italian
sz6_gKcHjtcpWKIZLXV85w,"Nightlife, Restaurants, Seafood, Bars, American (Traditional), Breakfast & Brunch","Or, The Whale",463 Blvd of the Allies,Pittsburgh,PA,15219,4.0,208,1,American
pKC_Nxvc2gk_ovj9MJ8cSQ,"Restaurants, Japanese",Sarku Japan,1000 Ross Park Mall Dr,Pittsburgh,PA,15237,3.0,3,1,Japanese
kVODXr00qMBklPZTP3X-lQ,"Adult Entertainment, Bars, Social Clubs, Arts & Entertainment, Nightlife, Community Service/Non-Profit, Restaurants, Local Services",Cheerleaders Gentlemen's Club,3100 Liberty Ave,Pittsburgh,PA,15201,2.5,19,1,American
QmNrHxN7UahtdliH_kAuUg,"Chinese, Cantonese, Restaurants",Ka Mei,2209 Murray Ave,Pittsburgh,PA,15217,3.5,83,1,Chinese
UPjwhZ3ywrkkhcZH1gbwHA,"Bars, Food Court, Nightlife, Restaurants",Oxford Market,"301 Grant St, Plaza Level",Pittsburgh,PA,15219,4.0,5,1,American
MsFj3NTvmhYNYS8Ef8HwFA,"Bars, Restaurants, Nightlife, Dive Bars",Shamrock Inn,917 Western Ave,Pittsburgh,PA,15233,4.0,4,0,American
lpxj6LFir23Ds6swW8a6fg,"Steakhouses, Seafood, Nightlife, American (Traditional), Lounges, Restaurants, Wine Bars, Event Planning & Services, Caterers, Bars",Grandview Saloon,1212 Grandview Ave,Pittsburgh,PA,15211,3.0,146,1,American
JLbgvGM4FXh9zNP4O5ZWjQ,"Meat Shops, Food, Specialty Food, Steakhouses, American (New), Restaurants, Gastropubs",Meat & Potatoes,649 Penn Ave,Pittsburgh,PA,15222,4.0,1755,1,American
f4Fwv8ClqR35p5chZWKSLQ,"Pizza, Restaurants",Italian Village Pizza,580 Old Clairton Rd,Pittsburgh,PA,15236,3.0,5,1,American
RXyBD1euUHNxhU3_LE7z6Q,"Restaurants, Indian",Maharaja Restaurant,1150 Banksville Rd,Pittsburgh,PA,15216,3.0,11,0,Indian
nVqOTTfDiu12xsQtFTO7_w,"Restaurants, Chinese, Convenience Stores, Food",Green Bamboo,472 44th St,Pittsburgh,PA,15201,2.5,11,0,Chinese
dAgImz1R-BKwR3sYhbPqRw,"Thai, Restaurants",Thai Touch Kitchen,665 Washington Rd,Pittsburgh,PA,15228,4.0,56,1,American
zuUWG7OdMv6awFRYhEYT5Q,"Bars, American (New), Restaurants, Nightlife, Breakfast & Brunch, Burgers",Local Bar + Kitchen,1515 E Carson St,Pittsburgh,PA,15203,3.0,229,1,American
h6JacIFzb9jxFpKpgsGuuQ,"American (Traditional), Pizza, Restaurants",Pittsburgh Grille,600 Grant St,Pittsburgh,PA,15219,2.0,12,0,American
5g0owkWApl_rgDl7D98Xow,"Restaurants, Food, American (Traditional)",4 Wood Grille,5840 Forward Ave,Pittsburgh,PA,15217,2.5,10,0,American
9d2wp4ddmkFSnUWjLv0mTQ,"Restaurants, Breakfast & Brunch, Diners",Folino's Ristorante,1719 E Carson St,Pittsburgh,PA,15203,3.5,7,0,American
ruD4E_OMlfEXTdMV0lDFIg,"Restaurants, Soul Food",Carmi Soul Food,1825 E Carson St,Pittsburgh,PA,15203,4.0,229,1,American
2hOU75OoYSid_aMUEvjhVQ,"Restaurants, Sandwiches, Seafood",Benkovitz Seafoods,2300 Smallman St,Pittsburgh,PA,15222,4.5,20,0,American
j2kjfjODIZyNPxAu1Dow6A,"Buffets, Chinese, Restaurants",Old Town Buffet,860 Saw Mill Run Blvd,Pittsburgh,PA,15226,2.5,57,0,Chinese
g2CMpjM8bBNQOQPIi4DKIw,"Food, Middle Eastern, Nightlife, Desserts, Vegetarian, Restaurants, Coffee & Tea",Your Inner Vagabond,4130 Butler Ave,Pittsburgh,PA,15201,3.0,6,0,Mediterranean
38aN0fB_zHtkw1kb3lSj8g,"Pizza, Restaurants",Michael's Pizza Bar & Restaurant,2612 Sarah St,Pittsburgh,PA,15203,4.0,85,1,American
DSyBqO8U8INz9cjduM6DzQ,"Beer, Wine & Spirits, Nightlife, Food, Restaurants, Seafood, Bars",Wintzell's Oyster House,530 E Bruceton Rd,Pittsburgh,PA,15236,3.5,51,0,American
YAci8e4YFgaVYyI1mDpp7Q,"Restaurants, American (New), Nightlife, Burgers, Bars",The Hop House,5510 Babcock Blvd,Pittsburgh,PA,15237,3.0,44,1,American
JHZzncoaHhqSn1Y9q6u_Fw,"Restaurants, Thai, Food",Kanok,242 S Highland Ave,Pittsburgh,PA,15206,3.5,17,0,American
28UWP-8hZ_-6klybRdzqEQ,"Sandwiches, Restaurants, Fast Food",Subway,6500 Steubenville Pike,Pittsburgh,PA,15205,2.5,3,1,American
t6LKeb5gNSeqri1JqOPZow,"Restaurants, Fast Food, Sandwiches",Subway,11667 Penn Hills Dr,Pittsburgh,PA,15235,4.0,4,1,American
DwmAsemahJywywhuqv5J1Q,"Restaurants, Szechuan, Chinese",Sichuan Gourmet,328 Atwood St,Pittsburgh,PA,15213,4.0,138,1,Chinese
grx1z5XwkWstfeyXsOPyNw,"Breakfast & Brunch, Restaurants, Diners",Pamela's,232 North Ave,Pittsburgh,PA,15209,4.0,103,1,American
mRWNt7hxoFzo5XZaoSC7aA,"American (Traditional), Restaurants, Nightlife, Dive Bars, Bars",Cappy's Cafe,5431 Walnut St,Pittsburgh,PA,15232,3.5,67,1,American
QbwJTaWoQjwABemmtGk9xg,"Italian, Seafood, Restaurants",La Cucina Flegrea,100 5th Ave,Pittsburgh,PA,15222,3.5,20,0,Italian
PvtAsnMf-oeNmkvdwRmEpw,"Restaurants, Desserts, Food, Sandwiches, Pizza",Yoli's Pizza,1216 Cochrans Mill Rd,Pittsburgh,PA,15236,4.5,47,0,American
a5mpYojV1dX7XCkAa1qq1A,"Salad, Restaurants, Juice Bars & Smoothies, Food, Mediterranean",Corelife Eatery,8009 McKnight Rd,Pittsburgh,PA,15237,4.0,80,1,Mediterranean
m1IqfCdWw0Yd1euC8cZgSA,"Restaurants, Diners, American (New)",Thee Olde Place Inn,1209 Streets Run Rd,Pittsburgh,PA,15236,3.5,23,1,American
zkW7OAv8Cnb-3SxEBOubTQ,"Chinese, Restaurants",Zhen Choo Chinese Restaurant,268 Yost Blvd,Pittsburgh,PA,15221,4.0,9,1,Chinese
ugmQx75KCr8nc8E-d69K8g,"Cafes, American (Traditional), Sandwiches, Restaurants, Diners, American (New)",Marketplace Cafe,1000 Ross Park Mall Dr,Pittsburgh,PA,15237,4.0,25,1,American
_VYUU5HPLYasd-xdKLimNA,"Chinese, Restaurants",Castle Place,331 Mount Lebanon Blvd,Pittsburgh,PA,15234,3.5,11,1,Chinese
lMx29wnA8FxJMcDoME_VoQ,"American (Traditional), Restaurants, Seafood",Joe's Crab Shack,6491 Robinson Center Dr,Pittsburgh,PA,15205,2.5,60,0,American
1zl7-8t8jQ4NX29qRp8soA,"Italian, Restaurants, Specialty Food, Food",City Fresh Pasta,2108 Murray Ave,Pittsburgh,PA,15217,4.0,4,1,Italian
XQjigVIJSnsXXUP1igIeEw,"Salad, Pizza, Sandwiches, Restaurants",Bomonti Pizza,51 Crennell Ave,Pittsburgh,PA,15205,4.5,5,1,American
1FDhJNAuPXRGbMi9x0muGA,"American (Traditional), Restaurants, Seafood",Joe's Crab Shack,226 W Station Dr,Pittsburgh,PA,15219,3.5,113,1,American
gOtY-I9lvbyOUShbBhCChQ,"Breakfast & Brunch, Restaurants",Pamela's,5813 Forbes Ave,Pittsburgh,PA,15217,4.0,61,0,American
w9IDJZeQhTQuBSTEu4nheA,"Salad, Bagels, Sandwiches, Food, Breakfast & Brunch, Soup, Bakeries, Restaurants",Panera Bread,400 Penn Center Blvd,Pittsburgh,PA,15235,2.5,17,1,American
ZMx9_sQydPUj5KGvcm73Sw,"Champagne Bars, Bars, American (New), Lounges, Nightlife, Cocktail Bars, Restaurants",Olive or Twist,140 6th St,Pittsburgh,PA,15222,3.5,265,1,American
5bF1zC3aEqiwYEkkdcWxKQ,"Burgers, Restaurants, Sandwiches, Hot Dogs",Lock & Dam Dog Shop,7331 Butler St,Pittsburgh,PA,15206,4.5,26,1,American
VNyrLWOqd8o6RdKs0I6Fwg,"Food, Restaurants, Ice Cream & Frozen Yogurt",Handel's Homemade Ice Cream & Yogurt,9020 St Simon Way,Pittsburgh,PA,15237,4.5,28,1,American
ehtDfDwcOBghAKAjgWlg4Q,"Sports Bars, American (Traditional), Restaurants, Nightlife, Bars",Shenanigans Bar & Grille,2310 Babcock Blvd,Pittsburgh,PA,15237,3.5,23,1,American
_Sx9XCDistFkOTq4ZHm09A,"Restaurants, Bars, American (Traditional), American (New), Burgers, Nightlife",Wicked Fox,1335 Freeport Rd,Pittsburgh,PA,15238,3.5,27,0,American
OXcnwnZj50WnFkHM1tk9pQ,"Bakeries, Restaurants, Food","Cellone's Bakery, Inc.",193 Chartiers Ave,Pittsburgh,PA,15205,3.5,3,1,American
QYlhQ9ivxXFSD7dE_1cy5A,"Restaurants, Chicken Wings, Sandwiches, Burgers",Big Shot Bob's House of Wings - Beechview,2102 Broadway Ave,Pittsburgh,PA,15216,4.0,33,1,American
X2X3n0PutSNonQQj2cjsCw,"Vegetarian, Vietnamese, Restaurants, Food",Tan Lac Vien,2114 Murray Ave,Pittsburgh,PA,15217,3.5,206,1,Vietnamese
rbZ4AHL1LV8KGW9NDGbI9w,"Florists, Shopping, Event Planning & Services, Local Services, American (New), Restaurants, Flowers & Gifts",Flowers In the Attic,7505 Saltsburg Rd,Pittsburgh,PA,15235,4.0,31,1,American
ZMvs7F5pGh-A4X2j9_W6kQ,"Nightlife, Restaurants, Seafood, Sandwiches, Bars",Gandy Dancer Saloon,100 W Station Sq Dr,Pittsburgh,PA,15219,3.5,47,1,American
7ULRdJfVo2-Og5ZoGOECFg,"Seafood, Restaurants, Greek, Food, Mediterranean",Mediterrano,2193 Babcock Blvd,Pittsburgh,PA,15209,3.5,63,0,Mediterranean
5jSwodZ2cLIgD0SLGXYbeg,"Asian Fusion, Buffets, Chinese, American (Traditional), Restaurants",City Buffet & Hibachi Grill,3500 William Penn Hwy,Pittsburgh,PA,15235,2.0,8,0,Chinese
MjD_bzVtkAIviFsNFGy7Zg,"Hot Dogs, Restaurants",Dormont Dogs,2911 Glenmore Ave,Pittsburgh,PA,15216,4.5,38,0,American
RBiJRcNC7NoDf-XYMFrCBg,"Restaurants, Desserts, Bakeries, Food",Jean-Marc Chatellier's French Bakery,213 North Ave,Pittsburgh,PA,15209,4.5,144,1,American
7QA9AjMvylQLMButvmoqnA,"Pizza, Restaurants, Sandwiches, American (Traditional)",Philly's Pitt Stop,1000 Chartiers Ave,Pittsburgh,PA,15220,2.5,5,0,American
QGPQp5VsRcP5Ma0ekCgj2Q,"Delis, American (New), Restaurants, Sandwiches",NU Jewish Bistro,1711 Murray Ave,Pittsburgh,PA,15217,4.0,104,1,American
3eivq15AzsACPuA5AyZUTA,"Food Trucks, Restaurants, Cajun/Creole, Food",The Pittsburgh PO Boy,,Pittsburgh,PA,,4.5,21,1,American
WjkjrsOzMAQ2wgY9tVyS0Q,"Event Planning & Services, Caterers, Fast Food, Mexican, Restaurants",QDOBA Mexican Eats,3712 Forbes Ave,Pittsburgh,PA,15213,3.0,37,0,Mexican
e-ZkvfbMZi628OKVcoFOAw,"Sushi Bars, Japanese, Restaurants, Poke, Food",Sushi Fuku,120 Oakland Ave,Pittsburgh,PA,15213,4.0,160,1,Japanese
Hb717wjzx1Q7cVXQo1-u2w,"Salad, American (Traditional), Burgers, Food, Ice Cream & Frozen Yogurt, Restaurants, Food Trucks",BRGR,535 Liberty Ave,Pittsburgh,PA,15222,4.0,32,1,American
#NAME?,"Restaurants, Bakeries, Italian, Pizza, Food",The Enrico Biscotti,2022 Penn Ave,Pittsburgh,PA,15222,4.0,158,1,Italian
t5DQeB3dORfNwx9otGUrSA,"American (Traditional), Sports Bars, Bars, Wine Bars, Burgers, Restaurants, Nightlife, Cocktail Bars",Casey's Draft House,1811 E Carson St,Pittsburgh,PA,15203,3.5,29,1,American
__sXvAzVGUsK6AyzT19v6g,"Pasta Shops, Italian, Caterers, Specialty Food, Event Planning & Services, Pizza, Food, Restaurants",Pizza & Pasta Villa,890 Butler St,Pittsburgh,PA,15223,2.0,11,1,Italian
Lb17BCffIA3kLXMjA9UlgQ,"American (New), Restaurants",Poppy's Bistro and Pub,4744 Liberty Ave,Pittsburgh,PA,15222,2.5,7,0,American
xLy3aWEbtpoUSVdjuHBS0A,"Restaurants, Vegetarian, Mexican, Seafood",Plaza Azteca,1000 Sutherland Dr,Pittsburgh,PA,15205,3.5,170,1,Mexican
9_1N2SoNoS3DGV9V-4kndw,"Food Court, Event Planning & Services, Caterers, Restaurants",Craftwork Kitchen,600 Grant St,Pittsburgh,PA,15219,4.0,24,1,American
QbLCALa347d6D09WJ37HXQ,"Restaurants, Fast Food, Sandwiches",Real McCoy Sandwich Shop,2010 E Carson St,Pittsburgh,PA,15203,4.5,10,0,American
T2jCFJO6DjtWIXkI1lcaOw,"Restaurants, Breakfast & Brunch",City Cafe,4502 Butler St,Pittsburgh,PA,15201,3.5,15,0,American
Ypsh993XXes9DZ8Cpyq5Fw,"Food, Coffee & Tea, Restaurants, Ice Cream & Frozen Yogurt, Sandwiches",Everyday's A Sundae,6014 Centre Ave,Pittsburgh,PA,15206,4.0,29,0,American
GQevJAnl6DWg80PJuOyX4g,"Restaurants, American (New)",Aspinwall Grille,211 Commercial Ave,Pittsburgh,PA,15215,4.0,8,0,American
2KrRu2odf_53L90UQLKVvA,"Salad, Sandwiches, Restaurants, Soup",Zoup!,1137 Freeport Rd,Pittsburgh,PA,15238,4.0,17,1,American
VRMNW1GXYihRxEnr1UI8hA,"Event Planning & Services, Restaurants, American (Traditional), Comfort Food, Caterers",Boston Market,1736 Washington Rd,Pittsburgh,PA,15241,4.5,3,0,American
WdjZK2Zti8mXSXXLYt-aoQ,"Restaurants, Mediterranean",Afamia Mediterranean Grille,663 Washington Rd,Pittsburgh,PA,15228,4.0,30,0,Mediterranean
5Oh4E8lTlAHzs4hrjsLFOA,"Pizza, Restaurants",Stockmano's Pizza,7678 Saltsburg Rd,Pittsburgh,PA,15239,4.0,9,1,American
kbq9QlIprqKpIWXZEXtGSA,"Chinese, Restaurants",No 1 Chinese Kitchen,11630 Frankstown Rd,Pittsburgh,PA,15235,3.0,10,1,Chinese
qJ-V22xGzV6IKNWA8c_Nnw,"Restaurants, Bakeries, Food",Mantsch Blue Bonnet Bakery,338 E 8th Ave,Pittsburgh,PA,15120,4.5,8,1,American
T8-13dD8mV2qUI53wsUL6g,"Event Planning & Services, Bars, American (New), Breakfast & Brunch, Burgers, Seafood, Caterers, Restaurants, Nightlife, American (Traditional), Diners",Atria's,1374 Freeport Rd,Pittsburgh,PA,15238,3.5,42,1,American
